url,title,content,summary,teams,date,venue,result,word_count,scraped_at,original_text,match_id,series_name,season,source_page
https://www.espncricinfo.com/series/ipl-2016-968923/mumbai-indians-vs-rising-pune-supergiants-1st-match-980901/match-report,"Seamers, Rahane lift Supergiants to winning start","Supergiants won by 9 wickets (with 32 balls remaining)

Rising Pune Supergiants made a sweet start to their life in the IPL, their seamers waylaying Mumbai Indians' top order to set up a breezy nine-wicket win over the defending champions

'We tried our best' - Harbhajan Singh

Karthik Krishnaswamy is a senior sub-editor at ESPNcricinfo

Over 15•RPS 126/1

'Ashwin has bailed me out in a lot of situations' - Dhoni

Despite giving him limited bowling opportunities in the last few matches, MS Dhoni has reiterated the importance of R Ashwin to his team

Methodical Rahane approach ensures win

Ajinkya Rahane's game - founded more on incremental run-gathering than rapid bursts of power-hitting - was perfectly conditioned to the Supergiants chase of 121

Benefited from losing the toss - du Plessis

Rising Pune Supergiants batsman Faf du Plessis has said losing the toss worked in his side's favour, by allowing them to assess conditions on an atypical Wankhede pitch.

Ajinkya Rahane steers Pune...",Supergiants won by 9 wickets (with 32 balls remaining),[],,,won by 9 wickets,234,2025-08-01T20:33:45.371373,Report,968923,"Indian Premier League (in India), 2016",2016,https://www.espncricinfo.com/series/ipl-2016-968923/match-schedule-fixtures-and-results
https://www.espncricinfo.com/series/ipl-2016-968923/gujarat-lions-vs-rising-pune-supergiants-6th-match-980911/match-report,"Finch, McCullum propel Lions to big win","Guj Lions won by 7 wickets (with 12 balls remaining)

Aaron Finch and Brendon McCullum pillaged 85 off 51 balls in a chase of 164, helping Gujarat Lions romp to a seven-wicket win against Rising Pune Supergiants in Rajkot

Nannes: Lions' defensive bowling impressive

Nikhil Kalro is a sub-editor at ESPNcricinfo

Over 19•GL 164/3

Ravindra Jadeja foxes Pune with neat bowling display

Ravindra Jadeja, with figures of two for 18 in his four-over spell, helped restrict Pune's power-packed batting line up to just 163 and in turn allowed Gujarat to comfortably beat them by seven wickets in the Indian Twenty20 competition in Rajkot on Thurs

Furious Supergiants start stymied by Jadeja

Holding back two of Ravindra Jadeja's overs until the end paid off handsomely for Gujarat Lions, helping them maintain a perfect start to their inaugural IPL campaign

When Dhoni dictated terms to Jadeja

Plays of the day from the game between Gujarat Lions and Rising Pune Supergiants in Rajkot

Finch, spinners...",Guj Lions won by 7 wickets (with 12 balls remaining),[],,,won by 7 wickets,221,2025-08-01T20:33:45.456737,Report,968923,"Indian Premier League (in India), 2016",2016,https://www.espncricinfo.com/series/ipl-2016-968923/match-schedule-fixtures-and-results
https://www.espncricinfo.com/series/ipl-2016-968923/kolkata-knight-riders-vs-delhi-daredevils-2nd-match-980903/match-report,Russell and Hogg rout Daredevils,"KKR won by 9 wickets (with 35 balls remaining)

Kolkata Knight Riders read a greenish Eden Gardens pitch and skittled Delhi Daredevils for 98, which the hosts chased with nine wickets and 35 balls to spare

Cullinan: Daredevils were horribly exposed

Deivarayan Muthu is a sub-editor at ESPNcricinfo

Over 15•KKR 99/1

Andre Russell lifts Kolkata to an easy win over Delhi

Andre Russell made the most of a greenish Eden Garden's pitch to claim three early wickets that helped Kolkata comfortably beat Delhi by a nine-wicket margin in their opening encounter of the Indian Twenty20 League on Sunday.

Daredevils' slump raises plenty of questions

Delhi Daredevils had gone through another revamp, but their first match of IPL 2016 showed they still have a few holes to plug

Bowlers set up thumping KKR win

You don't slog Mr Hogg

Plays of the day from the IPL game between Kolkata Knight Riders and Delhi Daredevils

Russell and Hogg rout Daredevils

Kolkata Knight Riders read a greenish Eden Gard...",KKR won by 9 wickets (with 35 balls remaining),[],,,won by 9 wickets,208,2025-08-01T20:33:45.535497,Report,968923,"Indian Premier League (in India), 2016",2016,https://www.espncricinfo.com/series/ipl-2016-968923/match-schedule-fixtures-and-results
https://www.espncricinfo.com/series/ipl-2016-968923/kings-xi-punjab-vs-rising-pune-supergiants-10th-match-980919/match-report,"Vijay, Vohra fifties give Kings XI first win","Kings XI won by 6 wickets (with 8 balls remaining)

Half-centuries from openers M Vijay and Manan Vohra gave Kings XI Punjab their first win of the IPL season after their bowlers had kept Rising Pune Supergiants to 152 in good batting conditions

Cullinan: Miller could learn from Maxwell

Karthik Krishnaswamy is a senior sub-editor at ESPNcricinfo

Over 19•KXIP 153/4

Sharmas tilt it Kings XI's way

Five key factors in Kings XI Punjab's six-wicket win over Rising Pune Supergiants in Mohali

Tennis at both ends, and a football interception

Plays of the day from Kings XI Punjab's first victory of the season, against Rising Pune Supergiants in Mohali

Mohit, openers set up Kings XI's six-wicket win

Vijay, Vohra fifties give Kings XI first win

Half-centuries from openers M Vijay and Manan Vohra gave Kings XI Punjab their first win of the IPL season after their bowlers had kept Rising Pune Supergiants to 152 in good batting conditions

Kings XI seek revival against settled Pune

Rising P...",Kings XI won by 6 wickets (with 8 balls remaining),[],,,won by 6 wickets,205,2025-08-01T20:33:45.563513,Report,968923,"Indian Premier League (in India), 2016",2016,https://www.espncricinfo.com/series/ipl-2016-968923/match-schedule-fixtures-and-results
https://www.espncricinfo.com/series/ipl-2016-968923/kings-xi-punjab-vs-gujarat-lions-3rd-match-980905/match-report,"Finch, Bravo lift Lions to victorious start","Guj Lions won by 5 wickets (with 14 balls remaining)

Aaron Finch and Dwayne Bravo helped Gujarat Lions ease into the IPL with a thumping win against Kings XI Punjab in Mohali

Agarkar: Kings XI could have a tough season

Nikhil Kalro is a sub-editor at ESPNcricinfo

Over 18•GL 162/5

Yorker, slower ball worked well for me - Bravo

Dwayne Bravo, who picked up 4 for 22 to set up Gujarat Lions' five-wicket win over Kings XI Punjab on Monday, was pleased with how his bowling variations had worked, particularly against Glenn Maxwell and David Miller

Dwayne Bravo helps Gujarat claim maiden win

Dwayne Bravo, the purple cap holder from the 2015 edition of the Indian Twenty20 league, was at it again and claimed four wickets to help his new team, Gujarat, outclass Punjab by five wickets in their opening encounter on Monday.

Limited Kings XI befuddled by middle muddle

No Indian batsman in the Kings XI line-up is close to threatening a spot in the T20I team, and it showed in the way they tied...",Guj Lions won by 5 wickets (with 14 balls remaining),[],,,won by 5 wickets,240,2025-08-01T20:33:45.596911,Report,968923,"Indian Premier League (in India), 2016",2016,https://www.espncricinfo.com/series/ipl-2016-968923/match-schedule-fixtures-and-results
https://www.espncricinfo.com/series/ipl-2016-968923/royal-challengers-bangalore-vs-sunrisers-hyderabad-4th-match-980907/match-report,RCB flex batting muscle to crush Sunrisers,"RCB won by 45 runs

Royal Challengers Bangalore blasted the first 200-plus score of the tournament in an emphatic 45-run win over Sunrisers Hyderabad at the M Chinnaswamy Stadium

Nannes: The way Sunrisers used Mustafizur was poor

Shashank Kishore is a senior sub-editor at ESPNcricinfo

Over 20•SRH 182/6

AB de Villiers powers Bangalore win over Hyderabad

AB de Villiers got Bangalore's campaign off to a winning start as he thumped a 42-ball 82 to help his side outdo Hyderabad by 45 runs in their opening clash of the Indian T20 tournament played in Bangalore on Tuesday.

Watson happy for new home comforts on RCB debut

Shane Watson played his first game for Royal Challengers Bangalore Tuesday night and enjoyed something he hadn't had for a couple of IPL seasons: a home crowd

Warped by Kohli-ABD stand, Sunrisers strategy Fizz-les out

With a 157-run partnership for Royal Challengers Bangalore in full flow, Sunrisers Hyderabad's most potent bowling threat - Mustafizur Rahman - was held...",RCB won by 45 runs,['Rcb'],,,won by 45 runs,220,2025-08-01T20:33:45.714245,Report,968923,"Indian Premier League (in India), 2016",2016,https://www.espncricinfo.com/series/ipl-2016-968923/match-schedule-fixtures-and-results
https://www.espncricinfo.com/series/ipl-2016-968923/delhi-daredevils-vs-kings-xi-punjab-7th-match-980913/match-report,"Mishra, de Kock hand Kings XI a thrashing","Daredevils won by 8 wickets (with 39 balls remaining)

A fine cocktail of experience and youth delivered Delhi Daredevils their first victory of the season, against Kings XI Punjab at the Feroz Shah Kotla

Deivarayan Muthu is a sub-editor at ESPNcricinfo

Over 14•DC 113/2

Amit Mishra's four-for wrecks Punjab

A sublime four-for from Amit Mishra helped Delhi register their first win of the 2016 edition of the Indian Twenty competition, as they mauled Punjab by an impressive eight-wicket margin in the Capital on Friday.

'There's a fine line between freedom and irresponsibility'

Kings XI Punjab may have dug themselves in a hole against Delhi Daredevils by losing wickets attempting expansive strokes, but the captain David Miller insists his team will not change the way they play

Mishra spins Delhi Daredevils to first win

Vohra dropped, Vijay run-out, off the same ball

Plays of the day from the IPL match between Delhi Daredevils and Kings XI Punjab

Mishra, de Kock hand Kings XI a thr...",Daredevils won by 8 wickets (with 39 balls remaining),[],,,won by 8 wickets,198,2025-08-01T20:33:45.763239,Report,968923,"Indian Premier League (in India), 2016",2016,https://www.espncricinfo.com/series/ipl-2016-968923/match-schedule-fixtures-and-results
https://www.espncricinfo.com/series/ipl-2016-968923/mumbai-indians-vs-gujarat-lions-9th-match-980917/match-report,Hobbling Finch wins Lions a thriller,"Guj Lions won by 3 wickets (with 0 balls remaining)

Aaron Finch overcame a bout of cramps to make an unbeaten 54-ball 67 as Gujarat Lions held their nerve to beat Mumbai Indians by three wickets in a last-ball thriller

Match Day - A thriller this IPL season needed

Gujarat Lions allrounder Dwayne Bravo has been reprimanded for showing dissent after he was given out caught behind against Mumbai Indians at the Wankhede Stadium. Bravo accepted the sanction after admitting to the offense.Bravo had tried to play a ramp shot to a Jasprit Bumrah short ball and was adjudged caught behind for 2 in the chase. Though the ball appeared to have deviated as it passed the bat, replays indicated that there was no edge.

Shashank Kishore is a senior sub-editor at ESPNcricinfo

Over 20•GL 147/7

Finch 67* takes Gujarat to third straight win

Aaron Finch's unbeaten 67 off 54 balls helped Gujarat overcome a middle-order wobble and chase down 144 against Mumbai to achieve their third successive win

Cram...",Guj Lions won by 3 wickets (with 0 balls remaining),[],,,won by 3 wickets,287,2025-08-01T20:33:45.842277,Report,968923,"Indian Premier League (in India), 2016",2016,https://www.espncricinfo.com/series/ipl-2016-968923/match-schedule-fixtures-and-results
https://www.espncricinfo.com/series/ipl-2016-968923/kolkata-knight-riders-vs-mumbai-indians-5th-match-980909/match-report,"Rohit, Buttler brush aside 188 target","MI won by 6 wickets (with 5 balls remaining)

A half-century from Rohit Sharma, coupled with explosive cameos from Jos Buttler and Mitchell McClenaghan, helped Mumbai Indians gun down 188 against Kolkata Knight Riders at Eden Gardens

O'Brien: Kolkata should have got 200

Alagappan Muthu is a sub-editor at ESPNcricinfo

Over 20•MI 188/4

Rohit Sharma's quick fire 84 helps Mumbai pip Kolkata

Mumbai needed to put their first-match loss to Pune behind them, and their captain, Rohit Sharma, helped them do just that, with a quick fire 54-ball 84 to overturn Kolkata by six wickets in the Indian T20 tournament at the Eden Gardens on Wednesday.

Rohit puts emphatic stamp on chase for Mumbai bounce-back

Five moments where Mumbai Indians won, and could have lost, the match to Kolkata Knight Riders

Mumbai's batting machine gets them on the board

Mumbai's surfeit of butterfingers

Plays of the day from the IPL match between Kolkata Knight Riders and Mumbai Indians in Kolkata

Rohit, Buttler br...",MI won by 6 wickets (with 5 balls remaining),[],,,won by 6 wickets,216,2025-08-01T20:33:45.948441,Report,968923,"Indian Premier League (in India), 2016",2016,https://www.espncricinfo.com/series/ipl-2016-968923/match-schedule-fixtures-and-results
https://www.espncricinfo.com/series/ipl-2016-968923/sunrisers-hyderabad-vs-kolkata-knight-riders-8th-match-980915/match-report,"Gambhir, bowlers lift KKR to convincing win","KKR won by 8 wickets (with 10 balls remaining)

With an attack comprising six international bowlers, Kolkata Knight Riders stamped their authority on Sunrisers Hyderabad to keep them to 142, and then hunted it down with eight wickets in hand

Nikhil Kalro is a sub-editor at ESPNcricinfo

Over 19•KKR 146/2

Uthappa praises 'batting chemistry' with Gambhir

Kolkata Knight Riders opener Robin Uthappa has said the ""batting chemistry"" he shares with his partner Gautam Gambhir has helped their productivity in the IPL

Knight Riders expose Sunrisers' lack of depth

The lack of firepower in the lower middle order meant Sunrisers Hyderabad had no way of recovering after losing three early wickets against a deep and varied Kolkata Knight Riders attack

Gambhir's omission and Russell's assist

Plays of the day from Sunrisers Hyderabad's first home game of the season, against Kolkata Knight Riders on Saturday

Gambhir, bowlers lift KKR to convincing win

With an attack comprising six international...",KKR won by 8 wickets (with 10 balls remaining),['Kkr'],,,won by 8 wickets,217,2025-08-01T20:33:46.233583,Report,968923,"Indian Premier League (in India), 2016",2016,https://www.espncricinfo.com/series/ipl-2016-968923/match-schedule-fixtures-and-results
https://www.espncricinfo.com/series/ipl-2016-968923/sunrisers-hyderabad-vs-mumbai-indians-12th-match-980923/match-report,Warner 90* leads Sunrisers to first win,"SRH won by 7 wickets (with 15 balls remaining)

An unbeaten 59-ball 90 from David Warner steered Sunrisers Hyderabad to their first win of the season after their bowlers had kept Mumbai Indians to 142

O'Brien: Warner is best opener across formats

Sunrisers Hyderabad pace bowlerBarinder Sranhas been fined 10% of his match fee for ""inappropriate behaviour deemed contrary to the spirit of the game"", following the game against Mumbai Indians. An IPL release said Sran pleaded guilty to the offence, though it did not specify what it was. It is likely that Sran was fined for sending off Mumbai Indians opener Parthiv Patel; Sran clapped his hands and showed Parthiv the way back to the dressing room immediately after bowling him with a slower delivery.

Karthik Krishnaswamy is a senior sub-editor at ESPNcricinfo

Over 18•SRH 145/3

David Warner steers Hyderabad to first win of 2016 season

Hyderabad's captain, David Warner, thumped an unbeaten 59-ball 90 to help his side trump Mumbai by an im...",SRH won by 7 wickets (with 15 balls remaining),[],,,won by 7 wickets,298,2025-08-01T20:33:47.427214,Report,968923,"Indian Premier League (in India), 2016",2016,https://www.espncricinfo.com/series/ipl-2016-968923/match-schedule-fixtures-and-results
https://www.espncricinfo.com/series/ipl-2016-968923/mumbai-indians-vs-royal-challengers-bangalore-14th-match-980927/match-report,"Krunal, Rohit reinvigorate Mumbai's campaign","MI won by 6 wickets (with 12 balls remaining)

Rohit Sharma returned to a familiar batting position to thwart Royal Challengers Bangalore's designs on a flat Wankhede deck and help Mumbai Indians revive their campaign with a six-wicket win

O'Brien: RCB have to score 200+ with their bowling attack

Shashank Kishore is a senior sub-editor at ESPNcricinfo

Over 18•MI 171/4

Rohit Sharma helps Mumbai dominate Bangalore

Mumbai's captain, Rohit Sharma, smashed a 44-ball 62 to help his side register their first home win of the 2016 season, as they comfortably beat Bangalore by six wickets in the Indian Twenty20 competition in Mumbai on Wednesday.

Krunal Pandya emerges as missing link in Mumbai turnaround

Mumbai tried Shreyas Gopal, Vinay Kumar and J Suchith in the first two games with little success, but Krunal Pandya has parlayed an audition in the team's third match against Gujarat Lions into a key role moving forward

Rohit pleased to find winning combo after early experimentation

Mum...",MI won by 6 wickets (with 12 balls remaining),[],,,won by 6 wickets,267,2025-08-01T20:33:47.483295,Report,968923,"Indian Premier League (in India), 2016",2016,https://www.espncricinfo.com/series/ipl-2016-968923/match-schedule-fixtures-and-results
https://www.espncricinfo.com/series/ipl-2016-968923/royal-challengers-bangalore-vs-delhi-daredevils-11th-match-980921/match-report,Quinton de Kock's 48-ball ton stuns RCB,"Daredevils won by 7 wickets (with 5 balls remaining)

Quinton de Kock's bruising 51-ball 108, the first hundred in IPL 2016, powered Delhi Daredevils to a seven-wicket win over Royal Challengers Bangalore at the M Chinnaswamy Stadium

Cullinan: This IPL could be the making of de Kock as global superstar

Shashank Kishore is a senior sub-editor at ESPNcricinfo

Over 20•DC 192/3

Not too worried about Gayle's form - Kohli

Royal Challengers Bangalore captain Virat Kohli has brushed off concerns over Chris Gayle's form and is confident the West Indies opener can come up with the runs when the team needs it

De Kock ton gives Delhi memorable win

Quinton de Kock's 51-ball 108 helped Delhi gun down their steep target of 192 and achieve a memorable win over Bangalore in Bangalore

De Kock relishes ton in successful Daredevils chase

Quinton de Kock, who struck the first century of IPL 2016, looked a tired man at the post-match press conference, but did not shy away from toasting his innings ...",Daredevils won by 7 wickets (with 5 balls remaining),['Rcb'],,,won by 7 wickets,262,2025-08-01T20:33:47.576328,Report,968923,"Indian Premier League (in India), 2016",2016,https://www.espncricinfo.com/series/ipl-2016-968923/match-schedule-fixtures-and-results
https://www.espncricinfo.com/series/ipl-2016-968923/gujarat-lions-vs-sunrisers-hyderabad-15th-match-980929/match-report,"Bhuvneshwar, Warner flatten Gujarat Lions","SRH won by 10 wickets (with 31 balls remaining)

A four-wicket haul from Bhuvneshwar Kumar and a half-century from David Warner paved the way for Sunrisers Hyderabad's second win, over Gujarat Lions in Rajkot

O'Brien: Sunrisers bowlers used massive square boundaries well

Deivarayan Muthu is a sub-editor at ESPNcricinfo

Over 15•SRH 137/0

'I don't pressurise myself' - Dhawan

Sunrisers Hyderabad opener Shikhar Dhawan has said that he did not put too much pressure on himself during his recent lean patch

David Warner rattles Gujarat with an unbeaten 74

Hyderabad's captain, David Warner's, third half century of the season helped his side complete a ten-wicket win over Gujarat in the Indian Twenty20 competition at Rajkot on Thursday.

Raina blows hot with the bat, cold with fielding tactics

He may have scored more than half his side's runs against Sunrisers Hyderabad, but Suresh Raina's superb batting effort was undermined in the field by his own captaincy

No big hits, but still a go...",SRH won by 10 wickets (with 31 balls remaining),[],,,won by 10 wickets,203,2025-08-01T20:33:47.725189,Report,968923,"Indian Premier League (in India), 2016",2016,https://www.espncricinfo.com/series/ipl-2016-968923/match-schedule-fixtures-and-results
https://www.espncricinfo.com/series/ipl-2016-968923/kings-xi-punjab-vs-kolkata-knight-riders-13th-match-980925/match-report,"Spinners, Uthappa lift Knight Riders to top of table","KKR won by 6 wickets (with 17 balls remaining)

Another dominant bowling performance followed by another effortless chase led Kolkata Knight Riders to their third win of the season, a six-wicket victory over Kings XI Punjab that took them top of the table

Agarkar: Maxwell makes same mistake every time

Nikhil Kalro is a sub-editor at ESPNcricinfo

Over 18•KKR 141/4

Sunil Narine impresses in comfortable win over Punjab

Sunil Narine, who failed to impress in Kolkata's win against Hyderabad three-days ago, was back to his wicket-taking ways and clinched two wickets to help his side beat Punjab by six wickets in the Indian Twenty20 competition in Mohali on Tuesday.

Home pitch sends Kings XI bats out of tune

The slow turning tracks in Mohali have left David Miller, Glenn Maxwell and the rest of the Kings XI Punjab lineup looking like they are playing away matches at home

Luck, anger and inadvertence

Plays of the day from Kolkata Knight Riders' comfortable six-wicket win against Kings...",KKR won by 6 wickets (with 17 balls remaining),[],,,won by 6 wickets,238,2025-08-01T20:33:47.731420,Report,968923,"Indian Premier League (in India), 2016",2016,https://www.espncricinfo.com/series/ipl-2016-968923/match-schedule-fixtures-and-results
https://www.espncricinfo.com/series/ipl-2016-968923/rising-pune-supergiants-vs-royal-challengers-bangalore-16th-match-980931/match-report,De Villiers and Kohli craft Royal Challengers win,"RCB won by 13 runs

Virat Kohli and AB de Villiers scored half-centuries once again as Royal Challengers Bangalore defended 185 against Rising Pune Supergiants for a 13-run win

O'Brien: Dhoni left too much for too late

Deivarayan Muthu is a sub-editor at ESPNcricinfo

Over 20•RPS 172/8

5000 runs, 0 hundreds

Virat Kohli hit his first T20 century after a long wait. Here's a look at the players who have scored the most T20 runs without a century

Pietersen ruled out of IPL with calf injury

In a blow to Rising Pune Supergiants' unimpressive season so far, their batsman Kevin Pietersen has been ruled out of the remainder of IPL 2016

AB de Villiers shines in Bangalore win over Pune

AB de Villiers top scored with a 46-ball 83 to help Bangalore narrowly beat Pune by 13 runs in a high scoring clash in the Indian Twenty20 competition in Pune on Friday.

KP injury 'blessing in disguise' - Dhoni

Kevin Pietersen being sidelined may help Rising Pune Supergiants plug gaps in their bowling, th...",RCB won by 13 runs,[],,,won by 13 runs,253,2025-08-01T20:33:47.801440,Report,968923,"Indian Premier League (in India), 2016",2016,https://www.espncricinfo.com/series/ipl-2016-968923/match-schedule-fixtures-and-results
https://www.espncricinfo.com/series/ipl-2016-968923/delhi-daredevils-vs-mumbai-indians-17th-match-980933/match-report,Daredevils take game after Mumbai's late stall,"Daredevils won by 10 runs

Delhi Daredevils defended 164 against Mumbai Indians and sealed a hat-trick of wins for the first time since IPL 2012

O'Brien: Mumbai left too much for the end

Over 20•MI 154/7

Rohit just couldn't get going in the middle stages - Ponting

Mumbai Indians coach Ricky Ponting said that his side's inability to maintain momentum in the middle overs of a 165-run chase against Delhi Daredevils was one of the main factors for their 10-run loss in Delhi

Mumbai Indians choke despite Rohit fifty

Pandya's collisions, and a familiar crowd favourite

Plays of the day from the IPL match between Delhi Daredevils and Mumbai Indians

Daredevils take game after Mumbai's late stall

Delhi Daredevils defended 164 against Mumbai Indians and sealed a hat-trick of wins for the first time since IPL 2012

Daredevils target rare hat-trick of wins

When they take on Mumbai Indians at Feroz Shah Kotla on Saturday, Delhi Daredevils will have a chance to do something they haven't done...",Daredevils won by 10 runs,[],,,won by 10 runs,191,2025-08-01T20:33:47.904090,Report,968923,"Indian Premier League (in India), 2016",2016,https://www.espncricinfo.com/series/ipl-2016-968923/match-schedule-fixtures-and-results
https://www.espncricinfo.com/series/ipl-2016-968923/gujarat-lions-vs-royal-challengers-bangalore-19th-match-980937/match-report,Lions win despite Kohli's maiden T20 ton,"Guj Lions won by 6 wickets (with 3 balls remaining)

Virat Kohli's maiden T20 century lifted Royal Challengers Bangalore to 180 for 2 - a total he thought was well above par - but Gujarat Lions' batsmen banded together excellently to run it down

Nannes: RCB scratchy without some top players

Over 20•GL 182/4

Gujarat tames Bangalore, despite Kohli ton

Bangalore failed to capitalise on a 63-ball ton from their captain, Virat Kohli, and lost their Indian Twenty20 competition encounter against Gujarat by six wickets in Rajkot on Sunday.

'We could have won chasing 200' - Smith

Gujarat Lions batsman Dwayne Smith said his team had backed itself to chase even a 200-plus total given that the Royal Challengers Bangalore's bowling line-up was ""not that strong.""

Bangalore trail home after Kohli's marathon effort

Virat Kohli went through the gears to record his maiden T20 hundred but it was not quite enough to inspire his side to victory

Lions batsmen crash Kohli's party

Oxenford's shield ...",Guj Lions won by 6 wickets (with 3 balls remaining),[],,,won by 6 wickets,197,2025-08-01T20:33:47.931713,Report,968923,"Indian Premier League (in India), 2016",2016,https://www.espncricinfo.com/series/ipl-2016-968923/match-schedule-fixtures-and-results
