url,title,content,summary,teams,date,venue,result,word_count,scraped_at,original_text,match_id,series_name,season,source_page
https://www.espncricinfo.com/series/ipl-2017-1078425/gujarat-lions-vs-delhi-daredevils-50th-match-1082640/match-report,Shreyas Iyer's 96 pulls Daredevils through in 196 chase,"Daredevils won by 2 wickets (with 2 balls remaining)

Shreyas Iyer's 57-ball 96 steered Delhi Daredevils through a tense chase of 196 and consigned Gujarat Lions to yet another defeat while batting first

Bangar: Iyer's use of the crease was impressive

Karthik Krishnaswamy is a senior sub-editor at ESPNcricinfo

Over 20•DC 197/8

Iyer, Cummins lead rescue act for Delhi

Shreyas Iyer recorded his highest Twenty20 score, going past his 86 for Mumbai last year

Classy Shreyas Iyer floors Gujarat Lions

Shreyas Iyer fought the fall of wickets at the other end to raze to his highest T20 score and steer Delhi Daredevils to a tense win

Shreyas Iyer's 96 pulls Daredevils through in 196 chase

Shreyas Iyer's 57-ball 96 steered Delhi Daredevils through a tense chase of 196 and consigned Gujarat Lions to yet another defeat while batting first

Flawed teams look for consolation win

Kanpur's first match of the season is a dead rubber between two troubled teams: Gujarat Lions invariably win when ...",Daredevils won by 2 wickets (with 2 balls remaining),[],,,won by 2 wickets,207,2025-08-01T20:34:08.152116,Report,1078425,"Indian Premier League (in India), 2017",2017,https://www.espncricinfo.com/series/ipl-2017-1078425/match-schedule-fixtures-and-results
https://www.espncricinfo.com/series/ipl-2017-1078425/sunrisers-hyderabad-vs-mumbai-indians-48th-match-1082638/match-report,"Dhawan, bowlers lead Sunrisers' cruise","SRH won by 7 wickets (with 10 balls remaining)

Sunrisers Hyderabad rode on a counter-attacking second-wicket partnership between Shikhar Dhawan and Moises Henriques to outplay Mumbai Indians and keep their playoff chances alive

'Mumbai should not experiment more for playoffs'

Akshay Gopalakrishnan is a sub-editor at ESPNcricinfo

Over 19•SRH 140/3

Laxman explains Nabi's selection over Williamson

VVS Laxman said Mohammad Nabi's success against Mumbai Indians showed the match-readiness of the Sunrisers bench

Dhawan, Henriques keep Hyderabad's playoff hopes alive

The duo guided Hyderabad to seventh win off 13 matches, which put them fourth in the points table

Nabi's accuracy handcuffs Mumbai

Mohammad Nabi unrelentingly built pressure on Mumbai Indians, his 12 dots in the Powerplay setting the tone for a clinical bowling display from Sunrisers Hyderabad

Dhawan, bowlers lead Sunrisers' cruise

Sunrisers Hyderabad rode on a counter-attacking second-wicket partnership between Shikha...",SRH won by 7 wickets (with 10 balls remaining),[],,,won by 7 wickets,221,2025-08-01T20:34:08.215959,Report,1078425,"Indian Premier League (in India), 2017",2017,https://www.espncricinfo.com/series/ipl-2017-1078425/match-schedule-fixtures-and-results
https://www.espncricinfo.com/series/ipl-2017-1078425/mumbai-indians-vs-kings-xi-punjab-51st-match-1082641/match-report,Kings XI barely defend 230 to stay alive,"Kings XI won by 7 runs

Mohit Sharma put three ordinary overs behind him to deliver a clinical final over, off which he defended 15, as Kings XI lived to fight another day

Hogg: Mohit was brilliant under pressure

Deivarayan Muthu is a sub-editor at ESPNcricinfo

Over 20•MI 223/6

Saha, Guptill star in Punjab win over Mumbai

The duo scored at 12.36 runs in the 5.3 overs that they batted together.

Kings XI's bold, high-risk choice reaps reward

With their playoffs spot on the line, Kings XI Punjab's decision to take the the high-risk, high-reward path of batting Mumbai out of the game paid off on a true Wankhede surface

Why Malinga has lost his sting, and a vintage big-hitting demo

Aakash Chopra analyses play from the run-fest in Mumbai, where Kings XI prevailed over the hosts

Saha finds his groove at the top

Wriddhiman Saha wasn't quite himself as a floater in the middle order; he seized his opportunity as an opener to score a breezy 93

Kings XI barely defend 230 to stay alive
...",Kings XI won by 7 runs,[],,,won by 7 runs,227,2025-08-01T20:34:08.924878,Report,1078425,"Indian Premier League (in India), 2017",2017,https://www.espncricinfo.com/series/ipl-2017-1078425/match-schedule-fixtures-and-results
https://www.espncricinfo.com/series/ipl-2017-1078425/gujarat-lions-vs-sunrisers-hyderabad-53rd-match-1082643/match-report,Sunrisers give themselves hope of top-two finish,"SRH won by 8 wickets (with 11 balls remaining)

Gujarat Lions managed the worst IPL collapse of all time: from 111 for 0 to 154 all out after they had looked like they could get to a defendable score on a flat pitch and a small ground

Agarkar: Sunrisers did it on the day that mattered

Sidharth Monga is an assistant editor at ESPNcricinfo

Over 19•SRH 158/2

Warner, Shankar make Gujarat pay for lapses in field

David Warner and Vijay Shankar scored at 8.76 runs an over to guide Hyderabad past Gujarat

Siraj tears through Lions' destructive start

Mohammed Siraj was taken for 22 in his first two overs, but he got in the way every time Gujarat Lions tried to make use of a solid base

Sunrisers give themselves hope of top-two finish

Gujarat Lions managed the worst IPL collapse of all time: from 111 for 0 to 154 all out after they had looked like they could get to a defendable score on a flat pitch and a small ground

Sunrisers set sights on playoff berth against weary Lions

A win for S...",SRH won by 8 wickets (with 11 balls remaining),[],,,won by 8 wickets,244,2025-08-01T20:34:09.350081,Report,1078425,"Indian Premier League (in India), 2017",2017,https://www.espncricinfo.com/series/ipl-2017-1078425/match-schedule-fixtures-and-results
https://www.espncricinfo.com/series/ipl-2017-1078425/delhi-daredevils-vs-royal-challengers-bangalore-56th-match-1082646/match-report,RCB end disappointing season with consolation win,"RCB won by 10 runs

They might have had heady highs and lowly lows in between but Delhi Daredevils ended their season as they began it: let down by their mercurial batsmen after the bowlers kept Royal Challengers Bangalore down to a middling total

Agarkar: Delhi have found ways to lose from winning positions all season

Sidharth Monga is an assistant editor at ESPNcricinfo

Over 20•DC 151/10

Kohli, Gayle help Royal Challengers finish strong

Chris Gayle and Virat Kohli added 66 runs to help Royal Challengers post 161 on a two-paced, sluggish surface at the Feroz Shah Kotla

Dravid rues Daredevils' inability to win tight games

In his evaluation of the Daredevils campaign, mentor Rahul Dravid said they were done in by their failure to close out tight games, as well as injuries to key players

Kohli ends lean season with fifty

On a pitch that he expected would offer a lot of turn, Virat Kohli played an innings that steadily amped up his side's scoring rate against Delhi Daredevils

RC...",RCB won by 10 runs,['Rcb'],,,won by 10 runs,281,2025-08-01T20:34:09.490846,Report,1078425,"Indian Premier League (in India), 2017",2017,https://www.espncricinfo.com/series/ipl-2017-1078425/match-schedule-fixtures-and-results
https://www.espncricinfo.com/series/ipl-2017-1078425/delhi-daredevils-vs-rising-pune-supergiant-52nd-match-1082642/match-report,Delhi keep Pune waiting for playoff spot,"Daredevils won by 7 runs

A fine display of death bowling led Delhi Daredevils to a seven-run victory at home over Rising Pune Supergiant

Hogg: It was a big choke from Rising Pune Supergiant

Alagappan Muthu is a sub-editor at ESPNcricinfo

Over 20•RPS 161/7

I want to take complete blame - Tiwary

Rising Pune Supergiant batsman Manoj Tiwary has taken ""complete blame"" for not finishing the game for his team against Delhi Daredevils on Friday night, which means they can still miss out on a playoff spot

Nair, Pant lead Delhi's charge over Pune

Karun Nair was particularly strong through midwicket, collecting 23 of his 64 runs in this region

Nair repays Daredevils' faith

Karun Nair ended a lengthy lean patch following his Test triple-century against England with a well-paced innings on a sluggish Kotla surface

Delhi keep Pune waiting for playoff spot

A fine display of death bowling led Delhi Daredevils to a seven-run victory at home over Rising Pune Supergiant

Top-two finish on Sup...",Daredevils won by 7 runs,[],,,won by 7 runs,214,2025-08-01T20:34:09.766488,Report,1078425,"Indian Premier League (in India), 2017",2017,https://www.espncricinfo.com/series/ipl-2017-1078425/match-schedule-fixtures-and-results
https://www.espncricinfo.com/series/ipl-2017-1078425/kolkata-knight-riders-vs-sunrisers-hyderabad-eliminator-1082648/match-report,Knight Riders survive rain scare in 1.27 am finish,"KKR won by 7 wickets (with 4 balls remaining) (D/L method)

Having restricted Sunrisers Hyderabad to 128, Kolkata Knight Riders survived a rain-induced scare to enter the second Qualifier with a seven-wicket win in a shortened chase

Agarkar: Bengaluru is not a 180 pitch anymore

Karthik Krishnaswamy is a senior sub-editor at ESPNcricinfo

Over 6•KKR 48/3

Whom should Sunrisers Hyderabad retain?

Pick which players you think Sunrisers Hyderabad should keep, if they are given a limited choice ahead of next year's reshuffle

'Twenty more minutes and we would have gone through' - Muralitharan

Despite the eliminator ending at 1.27am, Muttiah Muralitharan's wits were intact as he broke down Sunrisers Hyderabad's season and the loss against Kolkata Knight Riders in Bengaluru

Coulter-Nile, Yadav guide Kolkata to qualifier

Coulter-Nile claimed his fourth three-for in seven matches, most by a bowler, winning him his third MoM award

KKR's rain-riddled angst washed away by captain and colt

K...",KKR won by 7 wickets (with 4 balls remaining) (D/L method),[],,,won by 7 wickets,232,2025-08-01T20:34:09.752755,Report,1078425,"Indian Premier League (in India), 2017",2017,https://www.espncricinfo.com/series/ipl-2017-1078425/match-schedule-fixtures-and-results
https://www.espncricinfo.com/series/ipl-2017-1078425/kolkata-knight-riders-vs-mumbai-indians-54th-match-1082644/match-report,Knight Riders miss out on top-two finish as Mumbai defend 173,"MI won by 9 runs

Mumbai Indians ended the league stage of the IPL with a table-topping 20 points after they beat Kolkata Knight Riders by nine runs at the Eden Gardens

Hogg: Game lost for KKR with Yusuf's reckless dismissal

Karthik Krishnaswamy is a senior sub-editor at ESPNcricinfo

Over 20•KKR 164/8

Sharma, Tiwary help Mumbai clinch top spot

Mumbai ended the league stage of the Indian Twenty20 competition with a table-topping 20 points

Rayudu leaves imprint in rare opportunity

He was brought in to rest the season regulars, but a match-turning knock could give the team management a few selection headaches ahead of the playoffs

Knight Riders miss out on top-two finish as Mumbai defend 173

Mumbai Indians ended the league stage of the IPL with a table-topping 20 points after they beat Kolkata Knight Riders by nine runs at the Eden Gardens

Eden Gardens to decide who finishes No. 1

Mumbai Indians are through. KKR are highly likely to be through. The big question at Eden Gardens ...",MI won by 9 runs,[],,,won by 9 runs,202,2025-08-01T20:34:09.789679,Report,1078425,"Indian Premier League (in India), 2017",2017,https://www.espncricinfo.com/series/ipl-2017-1078425/match-schedule-fixtures-and-results
https://www.espncricinfo.com/series/ipl-2017-1078425/rising-pune-supergiant-vs-kings-xi-punjab-55th-match-1082645/match-report,Pune rout Kings XI for 73 to book second place,"Supergiant won by 9 wickets (with 48 balls remaining)

Led by their bowlers who exploited a pitch with just enough moisture to make driving on the up difficult, Steven Smith and his men booked a place in the playoffs

Hogg: Wretched show but Kings XI were also unlucky

Alagappan Muthu is a sub-editor at ESPNcricinfo

Over 12•RPS 78/1

Thakur, Unadkat clear Rising Pune's playoffs path

Jaydev Unadkat and Shardul Thakur combined to take five wickets in seven overs to help Rising Pune Supergiant dismantle Kings XI Punjab for 73

'Foreign players did not take responsibility' - Sehwag

Kings XI Punjab were knocked out of IPL 2017 after they recorded their lowest total in the tournament's history and their director of cricket operations was not pleased one bit

Thakur KO's his former team

Seamer Shardul Thakur returned career-best T20 figures of 3 for 19 to put Rising Pune Supergiant in the playoffs and end Kings XI Punjab's campaign

Pune rout Kings XI for 73 to book second place

Led by t...",Supergiant won by 9 wickets (with 48 balls remaining),[],,,won by 9 wickets,260,2025-08-01T20:34:09.880952,Report,1078425,"Indian Premier League (in India), 2017",2017,https://www.espncricinfo.com/series/ipl-2017-1078425/match-schedule-fixtures-and-results
https://www.espncricinfo.com/series/ipl-2017-1078425/mumbai-indians-vs-rising-pune-supergiant-qualifier-1-1082647/match-report,"Dhoni, Sundar vault Pune into the final","Supergiant won by 20 runs

On a slow pitch, Ajinkya Rahane, Manoj Tiwary and MS Dhoni led Rising Pune Supergiant to 162, a score they defended by 20 runs via Washington Sundar's 3 for 16, clearing their path to the IPL final

'Last two overs of Pune's innings made the difference'

Nikhil Kalro is a sub-editor at ESPNcricinfo

Over 20•MI 142/9

Partnerships of the week - Pandya, Johnson star in Mumbai's title win

Pandya-Johnson, Pandya-Sharma and Dhoni-Tiwary make the cut for the top partnerships of the week

Washington Sundar thinks his way to success

For someone so young, with no big variations, the Pune offspinner has done remarkably well thanks to his clarity of thought

Dhoni destroys and delights Mumbai

MS Dhoni was far from his best leading into and in this game. But when the ball was put in his half, that hardly mattered - much to the delight of even staunch Mumbai Indians fans

Dhoni, Tiwary onslaught hands Pune final berth

MS Dhoni and Manoj Tiwary plundered 41 runs off th...",Supergiant won by 20 runs,[],,,won by 20 runs,232,2025-08-01T20:34:10.108728,Report,1078425,"Indian Premier League (in India), 2017",2017,https://www.espncricinfo.com/series/ipl-2017-1078425/match-schedule-fixtures-and-results
https://www.espncricinfo.com/series/ipl-2017-1078425/mumbai-indians-vs-rising-pune-supergiant-final-1082650/match-report,Mumbai clinch third IPL title in last-ball finish,"MI won by 1 run

Mumbai Indians clinched their third IPL title in a pulsating last-ball finish, defending 129 to beat Rising Pune Supergiant by one run

Agarkar: Pune's over-cautious approach cost them the IPL

Karthik Krishnaswamy is a senior sub-editor at ESPNcricinfo

Over 20•RPS 128/6

When Dhoni came up against Mumbai Indians and lost again

The 2017 IPL final was a low-scoring affair but not lacking in thrills in the least

Four overs, three bowlers, one pulsating finish

With Rising Pune Supergiant needing only 33 from the last four overs, that too with eight wickets in hand, it took a special performance from Mumbai Indians' end-overs bowlers to steal a one-run win

Mumbai's bench strength bosses the IPL

They had a whole host of World Cup and World T20 winners and finalists on their roster. Is it any wonder they won the IPL?

Partnerships of the week - Pandya, Johnson star in Mumbai's title win

Pandya-Johnson, Pandya-Sharma and Dhoni-Tiwary make the cut for the top partnershi...",MI won by 1 run,[],,,won by 1 run,221,2025-08-01T20:34:10.232283,Report,1078425,"Indian Premier League (in India), 2017",2017,https://www.espncricinfo.com/series/ipl-2017-1078425/match-schedule-fixtures-and-results
https://www.espncricinfo.com/series/ipl-2017-1078425/kolkata-knight-riders-vs-mumbai-indians-qualifier-2-1082649/match-report,"Karn, Bumrah carry Mumbai into fourth IPL final","MI won by 6 wickets (with 33 balls remaining)

Karn Sharma and Jasprit Bumrah picked up their best T20 bowling figures, combining to take 7 for 23 in seven overs to lift Mumbai Indians into their fourth IPL final

Tait: Bumrah is consistent and unstoppable

Karthik Krishnaswamy is a senior sub-editor at ESPNcricinfo

Over 15•MI 111/4

Partnerships of the week - Pandya, Johnson star in Mumbai's title win

Pandya-Johnson, Pandya-Sharma and Dhoni-Tiwary make the cut for the top partnerships of the week

Sharma, Bumrah lift Mumbai into Final

Karn Sharma's figures of 4 for 16 are the joint third-best in a playoff match in the competition

Karn Sharma goes from replacement to main man

Harbhajan Singh was left out for Karn Sharma, and the legspinner rewarded Mumbai Indians with a spell that took them into the IPL 2017 final

Wily Karn ties up Knight Riders

After sitting out the first half of Mumbai's campaign, Karn Sharma showed up when it mattered with his best IPL effort to take Mumbai i...",MI won by 6 wickets (with 33 balls remaining),[],,,won by 6 wickets,228,2025-08-01T20:34:10.395995,Report,1078425,"Indian Premier League (in India), 2017",2017,https://www.espncricinfo.com/series/ipl-2017-1078425/match-schedule-fixtures-and-results
https://www.espncricinfo.com/series/ipl-2018-1131611/kings-xi-punjab-vs-delhi-daredevils-2nd-match-1136562/match-report,Rahul floors Daredevils with fastest IPL fifty,"Kings XI won by 6 wickets (with 7 balls remaining)

The opener's 14-ball half-century led Kings XI Punjab to a six-wicket win in Mohali

Agarkar: Rahul has the game to adapt to all formats

Coach's Diary: Kings XI need not worry about Yuvraj

Akshay Gopalakrishnan is a sub-editor at ESPNcricinfo

Over 19•KXIP 167/4

Racing to 50 in 15 or under

The fastest fifties in IPL history, featuring some of the world's mightiest hitters

Record-breaking Rahul returns in style

After missing the previous season to recover from a shoulder surgery, Rahul returned, with a new team, and took off from where he left off in 2016

Racing to 50 in under 20

The fastest fifties in IPL history, featuring some of the world's mightiest hitters

Rahul floors Daredevils with fastest IPL fifty

The opener's 14-ball half-century led Kings XI Punjab to a six-wicket win in Mohali

Ashwin v Gambhir in battle of revamped teams

Both Delhi Daredevils and Kings XI Punjab had disappointing seasons in 2017, but having pl...",Kings XI won by 6 wickets (with 7 balls remaining),[],,,won by 6 wickets,212,2025-08-01T20:34:10.871362,Report,1131611,"Indian Premier League (in India), 2018",2018,https://www.espncricinfo.com/series/ipl-2018-1131611/match-schedule-fixtures-and-results
https://www.espncricinfo.com/series/ipl-2018-1131611/mumbai-indians-vs-chennai-super-kings-1st-match-1136561/match-report,Bravo unleashes stunning assault to bring CSK screaming back,"CSK won by 1 wicket (with 1 ball remaining)

The allrounder hit seven sixes in a 30-ball 68 to snatch victory from what had been a dominant Mumbai Indians side for most of the match

Coach's Diary: CSK need explosive openers

Varun Shetty is a sub-editor at ESPNcricinfo

Over 20•CSK 169/9

'Tonight was just my night' - Bravo

The Super Kings allrounder was fully aware that his bowling had counted for a lot too, even though he had stunned the Wankhede crowd primarily with a match-winning 30-ball 68

'CSK is back in the IPL and how'

Current and former Chennai Super Kings' players reacted on social media to the team's astounding win in their first game back in the IPL

What Smart Stats say about Bravo's incredible performance

A look at the key performances in the opening game of the IPL through ESPNcricinfo's new metrics for T20 cricket

How Bravo turned the tables on Mumbai

After an excellent bowling performance at the death, Dwayne Bravo scripted an unlikely victory with a manic inni...",CSK won by 1 wicket (with 1 ball remaining),['Csk'],,,won by 1 wicket,235,2025-08-01T20:34:11.071930,Report,1131611,"Indian Premier League (in India), 2018",2018,https://www.espncricinfo.com/series/ipl-2018-1131611/match-schedule-fixtures-and-results
https://www.espncricinfo.com/series/ipl-2018-1131611/kolkata-knight-riders-vs-royal-challengers-bangalore-3rd-match-1136563/match-report,Sunil Narine ambushes Royal Challengers again,"KKR won by 4 wickets (with 7 balls remaining)

The Trinidadian smashed a 17-ball half-century to kickstart Knight Riders' chase after Nitish Rana's part-time offspin took out AB de Villiers and Virat Kohli to help restrict RCB to 176

Agarkar: I'd always get a fast bowler to bowl at Narine

Sreshth Shah is a sub-editor at ESPNcricinfo

Over 19•KKR 177/6

Talking points: A trick missed against Narine, and bizarre umpiring

Should Royal Challengers have bowled more pace in the Powerplay, and did the umpires fail to call a number of bouncers?

Narine's uncomplicated manner works against spin again

Sunil Narine stuck with his nonchalant swinging and proved effective against the odds yet again

Sunil Narine ambushes Royal Challengers again

The Trinidadian smashed a 17-ball half-century to kickstart Knight Riders' chase after Nitish Rana's part-time offspin took out AB de Villiers and Virat Kohli to help restrict RCB to 176

RCB look to spoil Dinesh Karthik's captaincy debut

Both teams be...",KKR won by 4 wickets (with 7 balls remaining),[],,,won by 4 wickets,205,2025-08-01T20:34:11.449623,Report,1131611,"Indian Premier League (in India), 2018",2018,https://www.espncricinfo.com/series/ipl-2018-1131611/match-schedule-fixtures-and-results
https://www.espncricinfo.com/series/ipl-2018-1131611/rajasthan-royals-vs-delhi-daredevils-6th-match-1136566/match-report,Royals return home with rain-hit victory,"RR won by 10 runs (D/L method)

Delhi Daredevils were set a target of 71 in six overs, after a rain delay of more than two and a half hours. They never really got going in the chase

Faulkner: Delhi should have chased this target down

Shashank Kishore is a senior sub-editor at ESPNcricinfo

Over 6•DC 60/4

Samson takes lead role for Royals, again

Sanju Samson's counterattack allowed Ajinkya Rahane and Jos Buttler to play their natural game, a tactic that helped set up Royals' 10-run win

Royals return home with rain-hit victory

Delhi Daredevils were set a target of 71 in six overs, after a rain delay of more than two and a half hours. They never really got going in the chase

Maxwell threat adds to Royals' challenge

Royals look to formidable home record in Jaipur, once their fortress, in their quest to turn things around after nine-wicket hiding in their opening game

Coach's Diary: Rain ruins Delhi's prospects

Faulkner: Samson's ability to play shots from the beginning is great

...",RR won by 10 runs (D/L method),[],,,won by 10 runs,181,2025-08-01T20:34:11.859450,Report,1131611,"Indian Premier League (in India), 2018",2018,https://www.espncricinfo.com/series/ipl-2018-1131611/match-schedule-fixtures-and-results
https://www.espncricinfo.com/series/ipl-2018-1131611/sunrisers-hyderabad-vs-mumbai-indians-7th-match-1136567/match-report,Frazzled Sunrisers squeeze home in last-ball thriller,"SRH won by 1 wicket (with 0 balls remaining)

Sunrisers Hyderabad lost 9 for 75, before the last-wicket pair of Hooda and Stanlake held their nerve to keep Mumbai Indians winless

Did Ben Cutting pick the right ball to bowl?

Shashank Kishore is a senior sub-editor at ESPNcricinfo

Over 20•SRH 151/9

Talking points: Sunrisers nearly throw it away

They were sloppy on the field and with the bat, but got away with a last-ball win

Variations, turn and control, the Markande way

A tremendous exhibition of flight and impressive command allowed Mayank Markande brought Mumbai Indians back from the dead in defense of a sub-par total

Frazzled Sunrisers squeeze home in last-ball thriller

Sunrisers Hyderabad lost 9 for 75, before the last-wicket pair of Hooda and Stanlake held their nerve to keep Mumbai Indians winless

Stiff test awaits Mumbai at venue of 2017 IPL glory

Mumbai were crowned IPL champions in Hyderabad last year, but the home team has had the most convincing victory so far this...",SRH won by 1 wicket (with 0 balls remaining),[],,,won by 1 wicket,191,2025-08-01T20:34:11.945492,Report,1131611,"Indian Premier League (in India), 2018",2018,https://www.espncricinfo.com/series/ipl-2018-1131611/match-schedule-fixtures-and-results
https://www.espncricinfo.com/series/ipl-2018-1131611/chennai-super-kings-vs-kolkata-knight-riders-5th-match-1136565/match-report,CSK chase 203 in blockbuster finish to homecoming,"CSK won by 5 wickets (with 1 ball remaining)

Sam Billings turned the match around with 56 off 23, leaving Andre Russell on the losing side despite his record 88

Dasgupta: Karthik got his calculation wrong

Nikhil Kalro is a sub-editor at ESPNcricinfo

Over 20•CSK 205/5

Dhoni to return to Pune as CSK forced to move home venue

The Chennai police commissioner advised CSK to ""reschedule"" the matches in the wake of the protests in the city over the Cauvery river water issue

Vinay Kumar asks trolls to 'chill' after failed last over against CSK

The Kolkata Knight Riders bowler has taken to Twitter to ask people mocking him to ease off following his unsuccessful defence of 16 in the final over against CSK

Agony, ecstasy, passion and pride: IPL returns to Chennai

A packed crowd at MA Chidambaram stadium experienced a cocktail of emotions, resulting in a win that was 'meant to be'

CSK win it the Dhoni way

All the numbers said one thing, MS Dhoni's team did something quite different and...",CSK won by 5 wickets (with 1 ball remaining),['Csk'],,,won by 5 wickets,246,2025-08-01T20:34:12.254453,Report,1131611,"Indian Premier League (in India), 2018",2018,https://www.espncricinfo.com/series/ipl-2018-1131611/match-schedule-fixtures-and-results
