url,title,content,summary,teams,date,venue,result,word_count,scraped_at,original_text,match_id,series_name,season,source_page
https://www.espncricinfo.com/series/ipl-2019-1165643/delhi-capitals-vs-mumbai-indians-34th-match-1178409/match-report,"Pandya brothers, Chahar star in Mumbai's emphatic win","MI won by 40 runs

Chasing 169, Capitals laboured to 128 for 9 and suffered their third loss in four games at home this season

Dasgupta: Rahul Chahar's action helps him get extra bounce

Andrew Fidel Fernando is ESPNcricinfo's Sri Lanka correspondent. @afidelf

Over 20•DC 128/9

Talking points - Whose home ground is the Feroz Shah Kotla?

Delhi Capitals have lost three out of their four games so far at the Feroz Shah Kotla, only managing to tie the fourth and win in the Super Over

Pandya brothers, Chahar star in Mumbai's emphatic win

Chasing 169, Capitals laboured to 128 for 9 and suffered their third loss in four games at home this season

Mumbai face bogey team at bogey ground

Delhi Capitals have a great record against Rohit Sharma's side winning six out of nine IPL games at Feroz Shah Kotla

Five reasons why Mumbai beat Capitals

Hardik's batting changed the momentum for us - Krunal

Tait: Hardik Pandya among the best batsmen in the death",MI won by 40 runs,[],,,won by 40 runs,167,2025-08-01T20:34:31.502074,Report,1165643,"Indian Premier League (in India), 2019",2019,https://www.espncricinfo.com/series/ipl-2019-1165643/match-schedule-fixtures-and-results
https://www.espncricinfo.com/series/ipl-2019-1165643/rajasthan-royals-vs-mumbai-indians-36th-match-1178411/match-report,New captain Smith leads Royals home to keep their campaign alive,"RR won by 5 wickets (with 5 balls remaining)

The five-wicket win was set up by some excellent bowling from Shreyas Gopal and Jofra Archer

Post-match show - Royals v Mumbai

Vishal Dikshit is a senior sub-editor at ESPNcricinfo

Over 20•RR 162/5

With the bat and in the mind, Steven Smith is 'happy where things are at'

'Perfect team man' Ajinkya Rahane responded positively to Royals' leadership change, says the new captain

Who should have won Player of the Match: Steven Smith or Shreyas Gopal?

ESPNcricinfo's Smart Stats throws up some interesting numbers from Rajasthan Royals' win over Mumbai Indians

How Archer and Unadkat beat the IPL's best batting side in the death

Mumbai Indians have been rampant in overs 16 to 20 thanks to Hardik Pandya and Kieron Pollard but in Jaipur they were both outdone

Talking Points - should Tripathi replace Rahane in the Royals XI?

The swap isn't as easy considering Rahane's stature as a top-tier cricketer, but if we look at the numbers, Tripathi h...",RR won by 5 wickets (with 5 balls remaining),[],,,won by 5 wickets,224,2025-08-01T20:34:31.698957,Report,1165643,"Indian Premier League (in India), 2019",2019,https://www.espncricinfo.com/series/ipl-2019-1165643/match-schedule-fixtures-and-results
https://www.espncricinfo.com/series/ipl-2019-1165643/sunrisers-hyderabad-vs-kolkata-knight-riders-38th-match-1178413/match-report,Warner and Bairstow punish sloppy Knight Riders,"SRH won by 9 wickets (with 30 balls remaining)

The Sunrisers Hyderabad batting pair put on 131 in just 12.2 overs, which reduced the 160-run chase to a cakewalk in the end

Plan was to save my overs for Russell - Rashid

Mohammad Isam is ESPNcricinfo's Bangladesh correspondent. @isam84

Over 15•SRH 161/1

No complaints from Andre Russell about batting position - Karthik

The Knight Riders captain also added that it was ""unfair"" to say his team was over-dependent on the West Indian allrounder

Talking points: How do you stop Dre Russ? Ask KKR

They had a chance to send Russell out in the ninth over, but waited until the 16th to unleash him

Warner and Bairstow punish sloppy Knight Riders

The Sunrisers Hyderabad batting pair put on 131 in just 12.2 overs, which reduced the 160-run chase to a cakewalk in the end

Bairstow backs Sunrisers' underemployed middle order

The middle-order batsmen have fluffed their lines a few times but lack of opportunities is to blame for it to a large exte...",SRH won by 9 wickets (with 30 balls remaining),[],,,won by 9 wickets,227,2025-08-01T20:34:31.824740,Report,1165643,"Indian Premier League (in India), 2019",2019,https://www.espncricinfo.com/series/ipl-2019-1165643/match-schedule-fixtures-and-results
https://www.espncricinfo.com/series/ipl-2019-1165643/delhi-capitals-vs-kings-xi-punjab-37th-match-1178412/match-report,"Shikhar Dhawan, Shreyas Iyer fifties guide Delhi Capitals to rare home win","DC won by 5 wickets (with 2 balls remaining)

Fifties from Shreyas Iyer and Shikhar Dhawan ensured Delhi Capitals survived a late wobble to beat Kings XI Punjab

Dasgupta and Tait celebrate Lamichhane's temperament

The IPL has slapped a fine of INR 12 lakh on Kings XI Punjab captain R Ashwin after finding that his team was slow to finish their overs in the game against Delhi Capitals at Feroz Shah Kotla. This is Kings XI's first such offense for the season.

Hemant Brar is a sub-editor at ESPNcricinfo

Over 20•DC 166/5

'I have just one aim: to win the IPL trophy this year'

Ishant Sharma has his eye on the big prize, and this season he has put his heart into getting Delhi Capitals there

Talking Points - Why Kings XI were unusually aggressive in the Powerplay

Not for the first time this season, a visiting team came to the Feroz Shah Kotla with a ground-specific batting strategy

Shikhar Dhawan, Shreyas Iyer fifties guide Delhi Capitals to rare home win

Fifties from Shreyas Iyer and...",DC won by 5 wickets (with 2 balls remaining),['Delhi Capitals'],,,won by 5 wickets,254,2025-08-01T20:34:31.907450,Report,1165643,"Indian Premier League (in India), 2019",2019,https://www.espncricinfo.com/series/ipl-2019-1165643/match-schedule-fixtures-and-results
https://www.espncricinfo.com/series/ipl-2019-1165643/chennai-super-kings-vs-sunrisers-hyderabad-41st-match-1178416/match-report,Shane Watson's 96 helps CSK maintain their spotless home record,"CSK won by 6 wickets (with 1 ball remaining)

After going ten innings without a half-century, the opener roared back to form with an innings reminiscent of his century in last season's final

Hard to get a chance in Sunrisers' playing XI - Shakib

Tait: Watson's always fancied facing spin

Danyal Rasool is a sub-editor at ESPNcricinfo. @Danny61000

Over 20•CSK 176/4

The curious case of the Chepauk pitch

Chennai Super Kings' fifth home game stood out by dint of the MA Chidambaram Stadium surface enabling better stroke-making than it has all season. Here's why

Shane Watson repays CSK's faith with memorable assault

Just as the critics were raising questions about his place in Chennai Super Kings' XI, the Australian silenced them with a menacing 96 against Sunrisers Hyderabad

Luck Index - How Watson made the most of his reprieve

Shane Watson was dropped when he was 33 off 26 balls. Here's why that was the most significant moment of the game

Talking Points - Does Shane Watson need a ...",CSK won by 6 wickets (with 1 ball remaining),['Csk'],,,won by 6 wickets,259,2025-08-01T20:34:32.239128,Report,1165643,"Indian Premier League (in India), 2019",2019,https://www.espncricinfo.com/series/ipl-2019-1165643/match-schedule-fixtures-and-results
https://www.espncricinfo.com/series/ipl-2019-1165643/royal-challengers-bangalore-vs-chennai-super-kings-39th-match-1178414/match-report,Royal Challengers Bangalore win last-ball thriller; Dhoni's 84* in vain,"RCB won by 1 run

With 26 to get in the last over, the Super Kings captain got it down to two off one ball before being beaten by Umesh's gutsy change of pace

I will never question what Dhoni does in the back end - CSK coach Fleming

Liam Brickhill is ESPNcricinfo's South Africa correspondent

Over 20•CSK 160/8

Five CSK-RCB classics: from Morkel's takedown of Kohli to Dayal's epic last over

The teams have built a rivalry that's given the IPL some of its strangest finishes and most replayed highlights

Super Kings left to seek more batting support for Dhoni

Their position at the top of the points table hasn't hidden their batting problems, and without a turnaround, things could get tougher as the league progresses

Why MS Dhoni refused those three singles

Here's the explanation, from the man himself. Also, Parthiv Patel's thoughts on his nerveless last-ball direct-hit

The two lucky events that helped Royal Challengers Bangalore's cause

In a match of narrow margins, two lucky even...",RCB won by 1 run,['Royal Challengers Bangalore'],,,won by 1 run,243,2025-08-01T20:34:32.340730,Report,1165643,"Indian Premier League (in India), 2019",2019,https://www.espncricinfo.com/series/ipl-2019-1165643/match-schedule-fixtures-and-results
https://www.espncricinfo.com/series/ipl-2019-1165643/rajasthan-royals-vs-delhi-capitals-40th-match-1178415/match-report,Pant's brilliance puts Rahane century in the shade,"DC won by 6 wickets (with 4 balls remaining)

The win means Capitals moved to the top of the IPL 2019 points table, the first time the franchise from Delhi has attained that position in the second half of an IPL season since 2012.

We had a plan for Archer's short balls and yorkers - Prithvi Shaw

Saurabh Somani is an assistant editor at ESPNcricinfo

Over 20•DC 193/4

'I have just one aim: to win the IPL trophy this year'

Ishant Sharma has his eye on the big prize, and this season he has put his heart into getting Delhi Capitals there

Rahane and Pant make statements by playing to strengths

One has been dropped as captain and both have missed out on the World Cup but this was a display of them at their best

Smart Stats: Pant 286.1 trumps Rahane 183.5

Though Ajinkya Rahane scored a century, his slow start and slow finish meant Rishabh Pant's rapid fifty was more valuable

Talking points: Rahane's dream T20 innings

In the last month, he's missed a World Cup spot and lost the Royals...",DC won by 6 wickets (with 4 balls remaining),[],,,won by 6 wickets,267,2025-08-01T20:34:32.575889,Report,1165643,"Indian Premier League (in India), 2019",2019,https://www.espncricinfo.com/series/ipl-2019-1165643/match-schedule-fixtures-and-results
https://www.espncricinfo.com/series/ipl-2019-1165643/royal-challengers-bangalore-vs-kings-xi-punjab-42nd-match-1178417/match-report,AB de Villiers' 82* keeps RCB's playoff hopes alive,"RCB won by 17 runs

A target of 203 proved beyond Kings XI's reach despite aggressive knocks from KL Rahul and Nicholas Pooran

AB de Villiers breaks another IPL record

Danyal Rasool is a sub-editor at ESPNcricinfo. @Danny61000

Over 20•KXIP 185/7

Passion or provocation: did Kohli mock Ashwin?

When asked what was going on, Ashwin's response was: ""I just play with passion, so does he""

Royal Challengers' hits, Kings XI's misses in the last three overs

The RCB bowlers adopted an approach far more disciplined than Kings XI's. The result: the winning team conceded 18 runs off the last three overs while Kings XI leaked 64

Talking Points - R Ashwin thrives in the age of wristspin

Dipping into his bag of variations, the Kings XI Punjab captain didn't concede a single boundary in his four overs

AB de Villiers' 82* keeps RCB's playoff hopes alive

A target of 203 proved beyond Kings XI's reach despite aggressive knocks from KL Rahul and Nicholas Pooran

Moeen Ali hopes to end his IPL wit...",RCB won by 17 runs,['Rcb'],,,won by 17 runs,227,2025-08-01T20:34:33.560492,Report,1165643,"Indian Premier League (in India), 2019",2019,https://www.espncricinfo.com/series/ipl-2019-1165643/match-schedule-fixtures-and-results
https://www.espncricinfo.com/series/ipl-2019-1165643/delhi-capitals-vs-royal-challengers-bangalore-46th-match-1178421/match-report,Delhi Capitals hold off Royal Challengers Bangalore to make playoffs after six-year gap,"DC won by 16 runs

Amit Mishra and Kagiso Rabada lead a strong performance with the ball after fifties from Shikhar Dhawan and Shreyas Iyer

Amit Mishra picked up two wickets in the 13th over •BCCI

Mohammad Isam is ESPNcricinfo's Bangladesh correspondent. @isam84

Over 20•RCB 171/7

Not looking at where we are on the points table - Ricky Ponting

Delhi Capitals won because they played the crunch moments better, Virat Kohli has conceded

Smart Stats: How about Sherfane Rutherford for Man of the Match?

The West Indian dasher made the highest contribution to Delhi Capitals' win according to ESPNcricinfo's Smart Stats

Talking Points - Capitals go where Daredevils had failed to since 2012

The senior opener's good form has coincided with Delhi Capitals' upward move on the points table

Delhi Capitals hold off Royal Challengers Bangalore to make playoffs after six-year gap

Amit Mishra and Kagiso Rabada lead a strong performance with the ball after fifties from Shikhar Dhawan and Shreyas ...",DC won by 16 runs,"['Royal Challengers Bangalore', 'Delhi Capitals']",,,won by 16 runs,216,2025-08-01T20:34:33.703147,Report,1165643,"Indian Premier League (in India), 2019",2019,https://www.espncricinfo.com/series/ipl-2019-1165643/match-schedule-fixtures-and-results
https://www.espncricinfo.com/series/ipl-2019-1165643/sunrisers-hyderabad-vs-kings-xi-punjab-48th-match-1178423/match-report,David Warner's 81 and Rashid Khan's three-for blow Kings XI Punjab away,"SRH won by 45 runs

The Australian opener ended his IPL stint with a ninth fifty-plus score, which set up a 200-plus score and solidified Sunrisers Hyderabad's playoff hopes

Five reasons why Sunrisers beat Kings XI

Danyal Rasool is a sub-editor at ESPNcricinfo. @Danny61000

Over 20•KXIP 167/8

Talking Points - Rahul's slow starts, Ashwin's management of bowlers

Why has KL Rahul started batting so slow initially? Why did Ashwin bowl Mujeeb at the death? We have a look in Talking Points

David Warner's 81 and Rashid Khan's three-for blow Kings XI Punjab away

The Australian opener ended his IPL stint with a ninth fifty-plus score, which set up a 200-plus score and solidified Sunrisers Hyderabad's playoff hopes

Kings XI seek to avoid 2018-like ouster after early success

Both teams look to avoid hat-trick of losses as the race for the playoffs heats up

Five reasons why Sunrisers beat Kings XI

212 was definitely chaseable - Rahul

Our bowling attack was clinical - Williamson",SRH won by 45 runs,['Kings Xi Punjab'],,,won by 45 runs,163,2025-08-01T20:34:34.027862,Report,1165643,"Indian Premier League (in India), 2019",2019,https://www.espncricinfo.com/series/ipl-2019-1165643/match-schedule-fixtures-and-results
https://www.espncricinfo.com/series/ipl-2019-1165643/chennai-super-kings-vs-delhi-capitals-50th-match-1178425/match-report,"Dhoni, Jadeja and Tahir send Capitals on a tailspin","CSK won by 80 runs

Raina's half-century turned around CSK's floundering innings before Dhoni delivered the blockbuster finish

Vettori: Dhoni's captaincy made CSK spinners more dangerous

Danyal Rasool is a sub-editor at ESPNcricinfo. @Danny61000

Over 17•DC 99/10

Losing Dhoni as a batter always difficult for us - Raina

The Chennai Super Kings batsman struck form after a lean season and lauded Dhoni's support at the crease against Delhi Capitals

MS Dhoni's ninja-like moves thrill Chepauk

The Chennai Super Kings captain pulled off two stumpings in three balls off Ravindra Jadeja to leave fans and his team-mate Suresh Raina in awe

Where is Delhi Capitals' foreign batting reserves?

They have a strong Indian top order, but the absence of a proven finisher in Indian conditions continues to be a concern

'Watch the ball, hit the ball' - Dhoni's formula for the final over

The CSK captain has hit 554 runs in 227 balls in the 20th over of an IPL match. That's 13% of all the runs he's ma...",CSK won by 80 runs,[],,,won by 80 runs,243,2025-08-01T20:34:34.023467,Report,1165643,"Indian Premier League (in India), 2019",2019,https://www.espncricinfo.com/series/ipl-2019-1165643/match-schedule-fixtures-and-results
https://www.espncricinfo.com/series/ipl-2019-1165643/rajasthan-royals-vs-sunrisers-hyderabad-45th-match-1178420/match-report,"Livingstone, Samson, Unadkat keep Royals' playoff hopes alive","RR won by 7 wickets (with 5 balls remaining)

Samson completes the chase without breaking a sweat after a lightning start from the openers and a fine bowling performance in the death

We couldn't build small partnerships or gain momentum - Williamson

Tait: Sunrisers' bowling unit have been quite inconsistent

Liam Brickhill is ESPNcricinfo's South Africa correspondent

Over 20•RR 161/3

Talking Points - Sunrisers Hyderabad fritter away another good start

Rajasthan Royals made numerous errors on the field and gifted away plenty of runs, but the visitors still failed to make a competitive total

Livingstone, Samson, Unadkat keep Royals' playoff hopes alive

Samson completes the chase without breaking a sweat after a lightning start from the openers and a fine bowling performance in the death

Depleted Royals have no margin for error as Sunrisers come calling

It's a must-win game for Steven Smith's men, while the stakes are slightly lower for the visitors, who are comparatively better-...",RR won by 7 wickets (with 5 balls remaining),[],,,won by 7 wickets,187,2025-08-01T20:34:34.033242,Report,1165643,"Indian Premier League (in India), 2019",2019,https://www.espncricinfo.com/series/ipl-2019-1165643/match-schedule-fixtures-and-results
https://www.espncricinfo.com/series/ipl-2019-1165643/chennai-super-kings-vs-mumbai-indians-44th-match-1178419/match-report,Irresistible Mumbai complete the double against Super Kings,"MI won by 46 runs

Krunal, Bumrah and Malinga induce a collapse after Rohit's first fifty of IPL 2019 leads Mumbai to an above-par total on a tired Chepauk surface

Agarkar: Rohit's runs on a difficult pitch showed his class

Tait: Mumbai got their team selection spot on

Over 18•CSK 109/10

How Mumbai breached Super Kings' fortress

CSK had an unbeaten home record in the 2019 IPL and hadn't failed in a chase in Chennai since 2013. Mumbai Indians came to town and ended that

Without Dhoni, Super Kings face their endgame

Dhoni doesn't just bat and keep wicket. When he is not there, it's a huge hole to fill and Super Kings look a far less formidable team

Talking Points - Chennai Super Kings laid low by lack of power-play

Chennai Super Kings - poor with the bat in the Powerplay, at their best with the ball in the middle overs

Irresistible Mumbai complete the double against Super Kings

Krunal, Bumrah and Malinga induce a collapse after Rohit's first fifty of IPL 2019 leads Mumbai to a...",MI won by 46 runs,[],,,won by 46 runs,246,2025-08-01T20:34:34.091456,Report,1165643,"Indian Premier League (in India), 2019",2019,https://www.espncricinfo.com/series/ipl-2019-1165643/match-schedule-fixtures-and-results
https://www.espncricinfo.com/series/ipl-2019-1165643/kolkata-knight-riders-vs-mumbai-indians-47th-match-1178422/match-report,Russell's 80* off 40 trumps Hardik's 91 off 34 as Knight Riders stay alive,"KKR won by 34 runs

Kolkata Knight Riders keep their IPL alive thanks to an all-round performance from their biggest match-winner

Can just appreciate Russell's contributions: de Kock

Murali Kartik: It was a good decision to send Russell at No.3

Sreshth Shah is a sub-editor at ESPNcricinfo

Over 20•MI 198/7

Smart Stats - Why Hardik was better than Russell

The Eden Gardens saw two breathtaking innings but the better one actually ended up on the losing side

I try to make sure there is no bickering and back-biting - Karthik

Questions were asked of the Kolkata Knight Riders and their captain after their six-match losing streak and Karthik answered them on Sunday after beating Mumbai Indians

Talking Points - Hardik Pandya, the superstar six-hitter

When the Mumbai Indians allrounder finally fell for 91 off 34, he had struck a six every 3.7 balls.

Russell's 80* off 40 trumps Hardik's 91 off 34 as Knight Riders stay alive

Kolkata Knight Riders keep their IPL alive thanks to an all-ro...",KKR won by 34 runs,[],,,won by 34 runs,222,2025-08-01T20:34:34.205789,Report,1165643,"Indian Premier League (in India), 2019",2019,https://www.espncricinfo.com/series/ipl-2019-1165643/match-schedule-fixtures-and-results
https://www.espncricinfo.com/series/ipl-2019-1165643/royal-challengers-bangalore-vs-rajasthan-royals-49th-match-1178424/match-report,"Gopal hat-trick in washout, RCB eliminated","Both teams took one point each and that meant Rajasthan Royals still have a chance of making the playoffs

Shreyas Gopal picked up a hat-trick •BCCI

Mohammad Isam is ESPNcricinfo's Bangladesh correspondent. @isam84

Over 4•RR 41/1

Gopal hat-trick in washout, RCB eliminated

Both teams took one point each and that meant Rajasthan Royals still have a chance of making the playoffs

How Royal Challengers Bangalore can still reach the playoffs

If RCB win both their remaining matches and other results work out well for them, they can still make the last four

Steven Smith hopes to sign off with a flourish

Smith will play his last match of IPL 2019 against Royal Challengers Bangalore before linking up with the Australian World Cup-bound team

Can Rajasthan Royals keep their hopes alive?

They need to win both their remaining games to retain a chance of qualifying, while RCB need a miracle

Vettori: Splitting of points a fair result based on circumstances

Vettori: Gopal enhanced his reput...",Both teams took one point each and that meant Rajasthan Royals still have a chance of making the playoffs,['Rcb'],,,no result,177,2025-08-01T20:34:34.308906,Report,1165643,"Indian Premier League (in India), 2019",2019,https://www.espncricinfo.com/series/ipl-2019-1165643/match-schedule-fixtures-and-results
https://www.espncricinfo.com/series/ipl-2019-1165643/kolkata-knight-riders-vs-rajasthan-royals-43rd-match-1178418/match-report,Dinesh Karthik's 97* in vain after Riyan Parag and Jofra Archer's late fireworks,"RR won by 3 wickets (with 4 balls remaining)

Chasing 176, Rajasthan Royals slipped to 123 for six before their seventh-wicket pair turned the tide with a partnership of 44 in 21 balls

We are aware our bowling needs to get better - Dinesh Karthik

Tait: Riyan Parag showing good temperament at a young age

Mohammad Isam is ESPNcricinfo's Bangladesh correspondent. @isam84

Over 20•RR 177/7

Knight Riders 'trust in their leader' - Karthik on captaincy

The Knight Riders captain also admitted that his team's bowling 'was found wanting' in recent matches

Talking points - the secret behind DK's success

Well, game awareness. It's the one thing a batsman needs to handle tough conditions and the KKR captain had plenty

Dinesh Karthik's 97* in vain after Riyan Parag and Jofra Archer's late fireworks

Chasing 176, Rajasthan Royals slipped to 123 for six before their seventh-wicket pair turned the tide with a partnership of 44 in 21 balls

Knight Riders host Royals with time running out for bot...",RR won by 3 wickets (with 4 balls remaining),[],,,won by 3 wickets,215,2025-08-01T20:34:34.411956,Report,1165643,"Indian Premier League (in India), 2019",2019,https://www.espncricinfo.com/series/ipl-2019-1165643/match-schedule-fixtures-and-results
https://www.espncricinfo.com/series/ipl-2019-1165643/mumbai-indians-vs-sunrisers-hyderabad-51st-match-1178426/match-report,Mumbai survive Pandey-Nabi scare to seal playoff qualification,"Match tied (MI won the one-over eliminator)

Manish Pandey's last-ball six took Sunrisers to the Super Over, but Mumbai cruised to a win after keeping them to 8 in the tie-breaker

Hardik Pandya leaps after taking Mumbai Indians to a win •BCCI

Mohammad Isam is ESPNcricinfo's Bangladesh correspondent. @isam84

Over 20•SRH 162/6

The slow poison of Rahul Chahar and Krunal Pandya

After a rollicking Powerplay, Mumbai Indians' spinners strangled Sunrisers Hyderabad with eight overs for 43 runs and the wickets of Williamson and Vijay Shankar

Bhuvneshwar attacks Hardik's weakness

What is Hardik's Achilles heel? Why did Rohit buck the chasing trend?

Mumbai survive Pandey-Nabi scare to seal playoff qualification

Manish Pandey's last-ball six took Sunrisers to the Super Over, but Mumbai cruised to a win after keeping them to 8 in the tie-breaker

Scenarios - How the Mumbai-Sunrisers result will affect the IPL playoff race

Rajasthan Royals will be rooting for Mumbai Indians on Thursday nig...",Match tied (MI won the one-over eliminator),[],,,tied,225,2025-08-01T20:34:34.834809,Report,1165643,"Indian Premier League (in India), 2019",2019,https://www.espncricinfo.com/series/ipl-2019-1165643/match-schedule-fixtures-and-results
