url,title,content,summary,teams,date,venue,result,word_count,scraped_at,original_text,match_id,series_name,season,source_page
https://www.espncricinfo.com/series/ipl-2021-1249214/chennai-super-kings-vs-royal-challengers-bangalore-19th-match-1254076/match-report,Ravindra Jadeja's all-round brilliance lifts CSK to top of table,"CSK won by 69 runs

The allrounder hammered a 28-ball 62, took 3-13, and effected a run-out against RCB

Manjrekar: Jadeja helped CSK score 37 in 20th over because of 'bad balls, awesome hitting'

Virat Kohli, the Royal Challengers captain, has been fined Rs 12 lakh after his team maintained a slow over-rate against the Super Kings. It was the team's first over-rate offence of the season.

Jadeja hammers 37 RUNS - equalling the highest runs scored in an over ever in the IPLhttps://t.co/YQD9dMoXXE|#CSKvRCB|#IPL2021pic.twitter.com/cUajcCf1Ym

He has barely warmed up, and Ravindra Jadeja is already changing games - in 3D

Vishal Dikshit is an assistant editor at ESPNcricinfo

Over 20•RCB 122/9

How Ravindra Jadeja has developed as a formidable T20 batter

He now has self-belief, skills, and the ability to intimidate bowlers

He has barely warmed up, and Ravindra Jadeja is already changing games - in 3D

Jadeja hit 62* off 28, then picked up 3 for 13, and also effected a run-out with a dir...",CSK won by 69 runs,['Csk'],,,won by 69 runs,288,2025-08-01T20:34:52.729780,Report,1249214,"Indian Premier League (in India/United Arab Emirates), 2021",2021,https://www.espncricinfo.com/series/ipl-2021-1249214/match-schedule-fixtures-and-results
https://www.espncricinfo.com/series/ipl-2021-1249214/punjab-kings-vs-kolkata-knight-riders-21st-match-1254078/match-report,"Morgan, bowlers lift Kolkata Knight Riders off bottom of IPL points table","KKR won by 5 wickets (with 20 balls remaining)

The Punjab Kings innings never really took off after they were asked to bat first in Ahmedabad

Chopra: Kings lacked intent at the start and kept losing wickets

With India experiencing a significant second wave of the Covid-19 pandemic, Kolkata Knight Riders captain Eoin Morgan was posed a question at the post-match press conference about whether he thinks the IPL should go on. He responded: ""When we came out of our first lockdown period, I remember the first sport was probably in New Zealand and then in Australia, the rugby union and the rugby league. Then slowly the Bundesliga started and the premier league started and that almost displayed you can play a sport when the country is almost in full lockdown. So if there is a template to make that happen, it has happened but also as long as it doesn't disturb what's happening in the public eye.""

Hemant Brar is a sub-editor at ESPNcricinfo

Over 17•KKR 126/5

Morgan, bowlers lift Kolkata K...",KKR won by 5 wickets (with 20 balls remaining),['Kolkata Knight Riders'],,,won by 5 wickets,290,2025-08-01T20:34:53.473425,Report,1249214,"Indian Premier League (in India/United Arab Emirates), 2021",2021,https://www.espncricinfo.com/series/ipl-2021-1249214/match-schedule-fixtures-and-results
https://www.espncricinfo.com/series/ipl-2021-1249214/sunrisers-hyderabad-vs-delhi-capitals-20th-match-1254077/match-report,Pant takes Capitals to victory in Super Over after Williamson helps Sunrisers tie the match,"Match tied (DC won the one-over eliminator)

Rashid Khan couldn't defend seven in the Super Over

Deep Dasgupta: 'It's a shame Williamson didn't have enough support'

Alagappan Muthu is a sub-editor at ESPNcricinfo

Over 20•SRH 159/7

Axar Patel: I told Rishabh Pant that I should bowl Super Over

The Delhi Capitals allrounder said Avesh Khan was initially supposed to deliver the Super Over

R Ashwin leaves IPL 2021 to 'support family' amid the pandemic

""My family and extended family are putting up a fight against #COVID19 and I want to support them during these tough times""

David Warner: 'Harsh call by selectors' to drop Manish Pandey

It remains unclear as of now who the ""selectors"" Warner was referring to are

Pant takes Capitals to victory in Super Over after Williamson helps Sunrisers tie the match

Rashid Khan couldn't defend seven in the Super Over

Capitals vs Sunrisers: who will deal with sluggish Chepauk better to come out on top?

David Warner's side will be eager to string...",Match tied (DC won the one-over eliminator),[],,,tied,214,2025-08-01T20:34:53.549989,Report,1249214,"Indian Premier League (in India/United Arab Emirates), 2021",2021,https://www.espncricinfo.com/series/ipl-2021-1249214/match-schedule-fixtures-and-results
https://www.espncricinfo.com/series/ipl-2021-1249214/delhi-capitals-vs-royal-challengers-bangalore-22nd-match-1254079/match-report,de Villiers blitz trumps Hetmyer-Pant fightback in one-run win as RCB regain top spot,"RCB won by 1 run

Siraj defended 13 in the final over, the unbeaten fifties from both Capitals batters in vain

Dasgupta: Lack of dew due to sandstorm helped RCB

Sreshth Shah is a sub-editor at ESPNcricinfo. @sreshthx

Over 20•DC 170/4

de Villiers blitz trumps Hetmyer-Pant fightback in one-run win as RCB regain top spot

Siraj defended 13 in the final over, the unbeaten fifties from both Capitals batters in vain

Fireworks loom as high-flying Capitals, Royal Challengers head to Motera

The season's quickest scoring powerplay teams could have a lot more bite on a truer surface

Sahi hai decisions - Kohli backs Siraj

Bishop: This IPL is significant for Hetmyer to prove himself

Dasgupta: Lack of dew due to sandstorm helped RCB",RCB won by 1 run,['Rcb'],,,won by 1 run,123,2025-08-01T20:34:53.983686,Report,1249214,"Indian Premier League (in India/United Arab Emirates), 2021",2021,https://www.espncricinfo.com/series/ipl-2021-1249214/match-schedule-fixtures-and-results
https://www.espncricinfo.com/series/ipl-2021-1249214/chennai-super-kings-vs-sunrisers-hyderabad-23rd-match-1254080/match-report,CSK canter to target of 172 to move to No. 1 on points table,"CSK won by 7 wickets (with 9 balls remaining)

Openers Ruturaj Gaikwad and Faf du Plessis hit rapid half-centuries to set up the victory

Daniel Vettori: The backing provided by the team management helped Ruturaj Gaikwad

Saurabh Somani is an assistant editor at ESPNcricinfo

Over 19•CSK 173/3

'Change in attitude' turning CSK's fortunes around from 2020 to 2021

Captain MS Dhoni says the ""players have taken more responsibility"" this season

David Warner takes 'full responsibility' for 'very slow' knock as Sunrisers Hyderabad sink further

The Sunrisers captain struggled to get going in a 55-ball innings, scoring just 57

CSK canter to target of 172 to move to No. 1 on points table

Openers Ruturaj Gaikwad and Faf du Plessis hit rapid half-centuries to set up the victory

Sinking Sunrisers look for lift against rising Super Kings in Delhi

To revive their season, the Sunrisers will need more than just their overseas personnel to perform

CSK vs SRH - IPL 2021 - Hindi review with Deep D...",CSK won by 7 wickets (with 9 balls remaining),['Csk'],,,won by 7 wickets,196,2025-08-01T20:34:54.035699,Report,1249214,"Indian Premier League (in India/United Arab Emirates), 2021",2021,https://www.espncricinfo.com/series/ipl-2021-1249214/match-schedule-fixtures-and-results
https://www.espncricinfo.com/series/ipl-2021-1249214/delhi-capitals-vs-kolkata-knight-riders-25th-match-1254082/match-report,Prithvi Shaw carnage leads Delhi Capitals to comprehensive win against Kolkata Knight Riders,"DC won by 7 wickets (with 21 balls remaining)

Shaw cracked 82 off just 41 balls, and smashed six fours in the opening over of the chase

Prithvi Shaw slammed 50 off 18 balls •BCCI/IPL

Saurabh Somani is an assistant editor at ESPNcricinfo

Over 17•DC 156/3

Prithvi Shaw's 'rare talent' lights up the IPL

The Delhi Capitals batter hit six fours in an over and went on to 'shell-shock' Kolkata Knight Riders

Brendon McCullum: 'I've asked time and time again for us to be more aggressive'

Coach ""very disappointed"" in KKR's slow scoring, says ""we're going to have to make some changes for sure""

Prithvi Shaw becomes second batter to slam six fours in an over in IPL

Shaw's onslaught came against KKR's Shivam Mavi

Prithvi Shaw carnage leads Delhi Capitals to comprehensive win against Kolkata Knight Riders

Shaw cracked 82 off just 41 balls, and smashed six fours in the opening over of the chase

Delhi Capitals hold all the trumps but cornered KKR could yet spring a surprise

Will the Capita...",DC won by 7 wickets (with 21 balls remaining),"['Kolkata Knight Riders', 'Delhi Capitals']",,,won by 7 wickets,217,2025-08-01T20:34:54.140733,Report,1249214,"Indian Premier League (in India/United Arab Emirates), 2021",2021,https://www.espncricinfo.com/series/ipl-2021-1249214/match-schedule-fixtures-and-results
https://www.espncricinfo.com/series/ipl-2021-1249214/mumbai-indians-vs-rajasthan-royals-24th-match-1254081/match-report,"Chahar, de Kock bring Mumbai back to winning ways","MI won by 7 wickets (with 9 balls remaining)

Chasing for the first time this IPL, de Kock's unbeaten 70 took Mumbai home

Quinton de Kock: A lot more fireworks from our guys yet to come

Vettori: Looks like a strategic move to bat Dube at No. 4

Hemant Brar is a sub-editor at ESPNcricinfo

Over 19•MI 172/3

Chahar, de Kock bring Mumbai back to winning ways

Chasing for the first time this IPL, de Kock's unbeaten 70 took Mumbai home

Can Mumbai's big hitters rediscover their mojo in Delhi?

Rajasthan Royals, too, will be hoping for a change of fortunes having struggled with the ball at the death

Dasgupta's Hindi review: Royals could have batted Miller at No. 4

Sanju Samson: We are going through a 'tough phase' without Archer, Stokes, Livingstone

Quinton de Kock: A lot more fireworks from our guys yet to come",MI won by 7 wickets (with 9 balls remaining),[],,,won by 7 wickets,146,2025-08-01T20:34:54.157472,Report,1249214,"Indian Premier League (in India/United Arab Emirates), 2021",2021,https://www.espncricinfo.com/series/ipl-2021-1249214/match-schedule-fixtures-and-results
https://www.espncricinfo.com/series/ipl-2021-1249214/punjab-kings-vs-royal-challengers-bangalore-26th-match-1254083/match-report,Harpreet Brar the hero after KL Rahul's 91* as Punjab Kings move up,"PBKS won by 34 runs

In the space of seven deliveries, Brar dismissed Kohli, Maxwell and de Villiers without conceding a single run

Manjrekar lauds 'superb' innings from Rahul

Andrew Miller is UK editor of ESPNcricinfo. @miller_cricket

Over 20•RCB 145/8

Harpreet Brar: Meet RCB's wrecker-in-chief who took out Kohli, Maxwell, de Villiers

Punjab Kings' 25-year-old allrounder also made a vital 17-ball 25 in only his fourth IPL game

KL Rahul ploughing a lone furrow for Punjab Kings

His steady strike rate has been a constant talking point since last IPL, whether he fails or he scores

Harpreet Brar the hero after KL Rahul's 91* as Punjab Kings move up

In the space of seven deliveries, Brar dismissed Kohli, Maxwell and de Villiers without conceding a single run

Inconsistent Punjab Kings face uphill challenge against Royal Challengers Bangalore's superstar batters

With AB de Villiers on fire and Harshal Patel running away with the purple cap, RCB will fancy their chances

Sar Utha Ke...",PBKS won by 34 runs,['Punjab Kings'],,,won by 34 runs,191,2025-08-01T20:34:54.212527,Report,1249214,"Indian Premier League (in India/United Arab Emirates), 2021",2021,https://www.espncricinfo.com/series/ipl-2021-1249214/match-schedule-fixtures-and-results
https://www.espncricinfo.com/series/ipl-2021-1249214/mumbai-indians-vs-chennai-super-kings-27th-match-1254084/match-report,Kieron Pollard's sensational takedown stuns Chennai Super Kings,"MI won by 4 wickets (with 0 balls remaining)

His stunning 34-ball 87 not out ends Chennai Super Kings' five-match winning streak

Kieron Pollard says a silent prayer after single-handedly taking Mumbai Indians home •BCCI/IPL

Hemant Brar is a sub-editor at ESPNcricinfo

Over 20•MI 219/6

Highest chases in the IPL - RCB's 230 in third place

Big chases bring all the drama and here is a list of five from the IPL that had almost everything

Highest chases in the IPL - SRH's 246 in second place

Big chases bring all the drama and here is a list of five from the IPL that had almost everything

The ever evolving genius of Kieron Pollard

He announced himself as a T20 phenom years ago, but now he has become better than ever, as Super Kings found out

Stats: Mumbai Indians ace second-highest IPL chase, as Kieron Pollard equals fast fifty for the franchise

Jasprit Bumrah suffers his most expensive spell in T20s

IPL 2021, match highlights: Mumbai Indians vs Chennai Super Kings

All the update...",MI won by 4 wickets (with 0 balls remaining),['Chennai Super Kings'],,,won by 4 wickets,212,2025-08-01T20:34:54.556330,Report,1249214,"Indian Premier League (in India/United Arab Emirates), 2021",2021,https://www.espncricinfo.com/series/ipl-2021-1249214/match-schedule-fixtures-and-results
https://www.espncricinfo.com/series/ipl-2021-1249214/punjab-kings-vs-delhi-capitals-29th-match-1254086/match-report,"Rabada, Dhawan take Delhi Capitals to the top","DC won by 7 wickets (with 14 balls remaining)

Agarwal's 99 on IPL captaincy debut in vain as Kings slump to fifth loss in eight matches

Shikhar Dhawan hit his third half-century of IPL 2021 •BCCI/IPL

Sidharth Monga is an assistant editor at ESPNcricinfo

Over 18•DC 167/3

IPL 2021, match highlights: Punjab Kings vs Delhi Capitals

All the updates, colour and analysis with ESPNcricinfo's match-day blog

KL Rahul to undergo surgery after being diagnosed with acute appendicitis

Mayank Agarwal was named captain for their game against the Delhi Capitals

Rabada, Dhawan take Delhi Capitals to the top

Agarwal's 99 on IPL captaincy debut in vain as Kings slump to fifth loss in eight matches

Rabada's form a slight concern for Capitals against confident Kings

Should Kings persist with Pooran? Is there place for Billings in place of Smith for Capitals?

Turning Point: Hyderabad's lost review and Axar's vital over

PBKS vs DC - IPL 2021 - Hindi review with Deep Dasgupta

Hetmyer: 'Ponting h...",DC won by 7 wickets (with 14 balls remaining),['Delhi Capitals'],,,won by 7 wickets,169,2025-08-01T20:34:54.665714,Report,1249214,"Indian Premier League (in India/United Arab Emirates), 2021",2021,https://www.espncricinfo.com/series/ipl-2021-1249214/match-schedule-fixtures-and-results
https://www.espncricinfo.com/series/ipl-2021-1249214/rajasthan-royals-vs-sunrisers-hyderabad-28th-match-1254085/match-report,Jos Buttler's 64-ball 124 sets up big Rajasthan Royals win,"RR won by 55 runs

David Warner's absence made no change to Sunrisers' performance on the field as the team remains rooted at the bottom

Jos Buttler celebrates his hundred •BCCI/IPL

Sreshth Shah is a sub-editor at ESPNcricinfo. @sreshthx

Over 20•SRH 165/8

Warner 'shocked and disappointed' at being removed from SRH captaincy, reveals Moody

Will Warner return to playing XI? Not if the new XI gets on a winning streak, says Trevor Bayliss

As it happened - Rajasthan Royals vs Sunrisers Hyderabad

All the updates, colour and analysis with ESPNcricinfo's match-day blog

Jos Buttler's 64-ball 124 sets up big Rajasthan Royals win

David Warner's absence made no change to Sunrisers' performance on the field as the team remains rooted at the bottom

Kane Williamson replaces David Warner as Sunrisers Hyderabad captain

The franchise also announced there will be a change in their overseas combination for their match on Sunday

Sunrisers, Royals in battle of laggards as Williamson set to take ...",RR won by 55 runs,['Rajasthan Royals'],,,won by 55 runs,214,2025-08-01T20:34:54.696737,Report,1249214,"Indian Premier League (in India/United Arab Emirates), 2021",2021,https://www.espncricinfo.com/series/ipl-2021-1249214/match-schedule-fixtures-and-results
https://www.espncricinfo.com/series/ipl-2021-1249214/chennai-super-kings-vs-mumbai-indians-30th-match-1254104/match-report,Chennai Super Kings go from 7 for 3 to victory courtesy Ruturaj Gaikwad,"CSK won by 20 runs

Deepak Chahar hurts Mumbai Indians early in pursuit of 157 to help seal the deal

Manjrekar: Not many players have scored off Bumrah like Gaikwad did today

Sign up for ESPN+and catch all the action from the IPL live in the US.Match highlights of Chennai Super Kings vs Mumbai Indiansavailable here in English, andhere in Hindi(US only).

Hemant Brar is a sub-editor at ESPNcricinfo

Over 20•MI 136/8

CSK toast 'very special innings' as faith in Ruturaj Gaikwad pays off

""Obviously one of my top innings till now because of the pressure we were in; the senior batters returned to the pavilion so I had to grind it.""

Chennai Super Kings go from 7 for 3 to victory courtesy Ruturaj Gaikwad

Deepak Chahar hurts Mumbai Indians early in pursuit of 157 to help seal the deal

Live Report - CSK vs MI, IPL 2021, Dubai

All the colour, stats and analysis on the Chennai Super Kings vs Mumbai Indians clash

IPL returns to UAE as familiar foes Mumbai Indians and Chennai Super Kings ta...",CSK won by 20 runs,['Chennai Super Kings'],,,won by 20 runs,255,2025-08-01T20:34:55.497813,Report,1249214,"Indian Premier League (in India/United Arab Emirates), 2021",2021,https://www.espncricinfo.com/series/ipl-2021-1249214/match-schedule-fixtures-and-results
https://www.espncricinfo.com/series/ipl-2021-1249214/kolkata-knight-riders-vs-royal-challengers-bangalore-31st-match-1254087/match-report,"Varun Chakravarthy, Andre Russell rout Royal Challengers Bangalore for 92 to set up big win","KKR won by 9 wickets (with 60 balls remaining)

After they shared six wickets between them, KKR's openers hunted down the target with ease

Sign up for ESPN+and catch all the action from the IPL live in the US.Match highlights of Kolkata Knight Riders vs Royal Challengers Bangaloreavailable here in English, andhere in Hindi(US only).

'We just weren't sharp enough with the bat' - Hesson says RCB implosion not due to distraction or team combination

Who is Venkatesh Iyer, KKR's latest debutant?

Vishal Dikshit is an assistant editor at ESPNcricinfo

Over 10•KKR 94/1

How good or not has Eoin Morgan been as KKR captain? It's complicated

There have been a whole lot of factors at play that make the question difficult to answer

New ground, new combination could spark KKR's comeback trail

The team had a poor first half of the season, but playing in Abu Dhabi might just offer them a chance to turn things around

'We just weren't sharp enough with the bat' - Hesson says RCB implosion not du...",KKR won by 9 wickets (with 60 balls remaining),['Royal Challengers Bangalore'],,,won by 9 wickets,283,2025-08-01T20:34:55.780759,Report,1249214,"Indian Premier League (in India/United Arab Emirates), 2021",2021,https://www.espncricinfo.com/series/ipl-2021-1249214/match-schedule-fixtures-and-results
https://www.espncricinfo.com/series/ipl-2021-1249214/delhi-capitals-vs-sunrisers-hyderabad-33rd-match-1254105/match-report,Nortje & Co help Delhi Capitals reclaim top spot,"DC won by 8 wickets (with 13 balls remaining)

Sunrisers Hyderabad on the brink of elimination after losing seven from eight

Manjrekar: Pant is the Sehwag of this generation

Sign up for ESPN+and catch all the action from the IPL live in the US. Match highlights of Delhi Capitals vs Sunrisers Hyderabad available herein English, and herein Hindi(US only).

Peter Della Penna is ESPNcricinfo's USA correspondent @PeterDellaPenna

Over 18•DC 139/2

Shreyas Iyer on getting runs - 'Not satisfied, appetite keeps increasing every match'

He says losing Delhi Capitals captaincy hasn't changed things drastically in terms of focus on batting

Nortje & Co help Delhi Capitals reclaim top spot

Sunrisers Hyderabad on the brink of elimination after losing seven from eight

As it happened - Delhi Capitals vs Sunrisers Hyderabad, IPL 2021, Dubai

All the colour, stats and analysis of the Delhi Capitals vs Sunrisers Hyderabad game

T Natarajan in isolation after testing positive for Covid-19

Six member...",DC won by 8 wickets (with 13 balls remaining),['Delhi Capitals'],,,won by 8 wickets,254,2025-08-01T20:34:56.003509,Report,1249214,"Indian Premier League (in India/United Arab Emirates), 2021",2021,https://www.espncricinfo.com/series/ipl-2021-1249214/match-schedule-fixtures-and-results
https://www.espncricinfo.com/series/ipl-2021-1249214/royal-challengers-bangalore-vs-chennai-super-kings-35th-match-1254113/match-report,"Dwayne Bravo-led attack does the job, Super Kings return to No. 1","CSK won by 6 wickets (with 11 balls remaining)

From 111 for 0 in 13 overs, Royal Challengers could manage only a below-par 156 for 6

Manjrekar: Kohli slowed down 'for no apparent reason'

Sign up for ESPN+and catch all the action from the IPL live in the US. Match highlights of Royal Challengers Bangalore vs Chennai Super Kings is available herein English, and herein Hindi(US only).

Shashank Kishore is a senior sub-editor at ESPNcricinfo

Over 19•CSK 157/4

CSK's new chasing mantra: Bat faster and smarter, not deeper

Thanks to extraordinary batting depth, they have been able to minimise the risk and score more runs through the middle overs

Dwayne Bravo-led attack does the job, Super Kings return to No. 1

From 111 for 0 in 13 overs, Royal Challengers could manage only a below-par 156 for 6

Live Report - RCB vs CSK, IPL 2021, Sharjah

Get your dose of stats, colour and analysis on Royal Challengers Bangalore vs Chennai Super Kings on ESPNcricinfo's live blog

Can Royal Challengers...",CSK won by 6 wickets (with 11 balls remaining),[],,,won by 6 wickets,233,2025-08-01T20:34:56.089759,Report,1249214,"Indian Premier League (in India/United Arab Emirates), 2021",2021,https://www.espncricinfo.com/series/ipl-2021-1249214/match-schedule-fixtures-and-results
https://www.espncricinfo.com/series/ipl-2021-1249214/punjab-kings-vs-rajasthan-royals-32nd-match-1254111/match-report,Kartik Tyagi concedes just one run in final over to stun Punjab Kings,"RR won by 2 runs

Kings needed only four off the final over with eight wickets in hand, but they came up short

Kartik Tyagi pulled off a coup for Rajasthan Royals •BCCI

Sign up for ESPN+and catch all the action from the IPL live in the US. Match highlights of Punjab Kings vs Rajasthan Royals available herein English, and herein Hindi(US only).

With 3 balls to go, Punjab Kings had a 100% chance of winninghttps://t.co/RhYPYXTkAE|#PBKSvRR|#IPL2021pic.twitter.com/CkhHXrA7l9

Rajasthan Royals captain Sanju Samson has been fined INR 12 lakh after his team maintained a slow over-rate during their match against Punjab Kings in Dubai. It was his team's first offence of the season under the IPL's Code of Conduct relating to minimum over-rate offences.

Manjrekar: Arshdeep's five-for one of the best in IPL

Peter Della Penna is ESPNcricinfo's USA correspondent @PeterDellaPenna

Over 20•PBKS 183/4

Stats - The Rahul-Agarwal century partnership jinx, and Tyagi's excellent final over

All the sta...",RR won by 2 runs,['Punjab Kings'],,,won by 2 runs,333,2025-08-01T20:34:56.120433,Report,1249214,"Indian Premier League (in India/United Arab Emirates), 2021",2021,https://www.espncricinfo.com/series/ipl-2021-1249214/match-schedule-fixtures-and-results
https://www.espncricinfo.com/series/ipl-2021-1249214/delhi-capitals-vs-rajasthan-royals-36th-match-1254097/match-report,Anrich Nortje leads Delhi Capitals' stifling bowling in win over Rajasthan Royals,"DC won by 33 runs

Iyer hits 43 before Royals collapse around Samson

Brathwaite: Capitals have the best bowling attack in IPL

Sign up for ESPN+and catch all the action from the IPL live in the US. Match highlights of Delhi Capitals vs Rajasthan Royals is available herein English, and herein Hindi(US only).

Rajasthan Royals captain Sanju Samson has been fined for a slow over-rate for the second time since the IPL has resumed. For the second offence, he will be fined INR 24 lakh, while his team-mates who played against Delhi Capitals will be fined the lesser of INR 6 lakh or 25 percent of their individual match fees.

Peter Della Penna is ESPNcricinfo's USA correspondent @PeterDellaPenna

Over 20•RR 121/6

Nortje reaping rewards after frustrating first half of IPL

Fast bowler is the toast of the team after taking four wickets in his first two games

Anrich Nortje leads Delhi Capitals' stifling bowling in win over Rajasthan Royals

Iyer hits 43 before Royals collapse around Samson

Li...",DC won by 33 runs,"['Rajasthan Royals', 'Delhi Capitals']",,,won by 33 runs,248,2025-08-01T20:34:56.202575,Report,1249214,"Indian Premier League (in India/United Arab Emirates), 2021",2021,https://www.espncricinfo.com/series/ipl-2021-1249214/match-schedule-fixtures-and-results
